Category,Announcement ,Type (Stage),Amount,Company,Fundraising Round,Sector,Investors,Date,Stage
Space Systems,https://www.trueanomaly.space/newsroom/announcing-our-260m-fundraise,Series C,260000000,True Anomoly,True Anomoly – Series C,Military Satellites,"Accel, Meritech Capital, Eclipse, Riot Ventures, Menlo Ventures, 645 Ventures, ACME Capital, Space VC, Champion Hill Ventures, Narya",2025-04-30,Late Stage Venture
Platform Systems,https://www.hermeus.com/press-release-series-b,Series B,100000000,Hermeus,Hermeus – Series B,Military Aircraft,"Sam Altman, Founders Fund, In-Q-Tel, Khosla Ventures, Canaan Partners, Bling Capital, Revolution's Rise of the Rest Seed Fund",2022-03-10,Early Stage Venture
Support & Services,https://www.businesswire.com/news/home/20221011005573/en/Airbus-Ventures-Leads-Solestial%E2%80%99s-Oversubscribed-10M-Seed-Round,Seed,10000000,Solestial,Solestial – Seed,Power & Energy Systems,"Airbus, AEI HorizonX, GPVC, Stellar Ventures, Industrious Ventures",2022-10-11,Seed
Platform Systems,https://www.businesswire.com/news/home/20201221005171/en/Dive-Technologies-Closes-on-New-Equity-Financing-Round-to-Deliver-on-2021-Commercial-and-Defense-Opportunities,Undisclosed,4000000,Dive Technologies,Dive Technologies – Undisclosed,Maritime Systems,"Tanis Venture Management, Virginia Tech Carilion Innovation Fund, Mill Town Capital, Virginia Tech Carilion Seed Fund, Cavalier Angels, Charlottesville Angel Network",2020-12-21,Miscellaneous
Platform Systems,https://www.overland.ai/news/overland-ai-raises-32m-in-series-a-to-transform-ground-operations-for-defense,Series A,32000000,Overland,Overland – Series A,Unmanned Ground Vehicles (UGVs),"8VC, Point72 Ventures, Overmatch Ventures, Shasta Ventures, Ascend, Osage University Partners, Caprock",2025-01-22,Early Stage Venture
Weapon Systems,https://www.prnewswire.com/news-releases/x-bow-systems-closes-funding-from-lockheed-martin-ventures-and-company-insiders-301991355.html,Strategic,0,X-Bow,X-Bow – Strategic,Missiles & Guided Munitions,"Crosslink, Razor’s Edge, Lockheed Martin Ventures, Balerion Space Ventures, Bravo Victor Venture Capital, Capital Factory",2023-11-16,Miscellaneous
Electronic Systems,https://www.businesswire.com/news/home/20241112876622/en/CHAOS-Industries-Raises-145-Million-Series-B-to-Accelerate-Defense-and-National-Security-Technology-Development,Series B,145000000,Chaos,Chaos – Series B,Radar Systems,"Accel, 8VC, Overmatch Ventures, Lerner Enterprises",2024-11-13,Early Stage Venture
Electronic Systems,https://anysignal.medium.com/anysignal-closes-seed-round-to-build-multi-domain-radio-platform-ab8aa6844bc8,Seed,5000000,AnySignal,AnySignal – Seed,Radar Systems,"BlueYard Capital, First In, Also Capital, Acequia Capital, Caffeinated Capital",2023-10-16,Seed
Space Systems,https://www.he360.com/hawkeye-360-receives-58-million-in-series-d-1-funding-to-introduce-a-new-satellite-architecture-and-accelerate-data-science-efforts/,Extension,58000000,HawkEye 360,HawkEye 360 – Extension,Space-based Sensors & ISR,"Manhattan Venture Partners, Insight Partners, NightDragon, Alumni Ventures, Strategic Development Fund, Razor’s Edge, Adage Capital",2023-07-13,Late Stage Venture
Electronic Systems,https://www.theseus.us/blog/theseus-seed,Seed,4300000,Theseus,Theseus – Seed,Navigation & Guidance Systems,"First Round Capital, Y Combinator, Lux Capital",2025-04-17,Seed
Support & Services,https://amca.co/launch/,Seed,76000000,AMCA,AMCA – Seed,Manufacturing Support,"Founders Fund, Andreessen Horowitz (a16z), Lux Capital, Caffeinated Capital",2025-04-08,Seed
Software & IT Services,https://www.ft.com/content/fc69f2b8-8016-4833-a9e1-61154e4b25eb,Series A,118000000,Helsing,Helsing – Series A,Data Analytics & AI,Prima Materia,2021-11-09,Early Stage Venture
