Fundraising Round,Sector,Investors,Type (Stage),Announcement ,Category,Date,Stage,Company,Amount
Aetherflux – Series A,Power & Energy Systems,"Index Ventures, Interlagos, Breakthrough Energy Ventures, Andreessen Horowitz (a16z), NEA, Vlad Tenev, Jared Leto, François-Paul Journe",Series A,https://aetherflux.medium.com/aetherflux-raises-50-million-to-deliver-energy-to-planet-earth-b5a6859cb0ce,Support & Services,2025-04-02,Early Stage Venture,Aetherflux,50000000
Vannevar Labs – Series B,Defense Software,"Felicis, DFJ Growth, Aloft VC, Costanoa Ventures, Point72 Ventures, General Catalyst, Shield Capital",Series B,https://www.prnewswire.com/news-releases/vannevar-labs-announces-75m-series-b-funding-round-301725181.html,Software & IT Services,2023-01-18,Early Stage Venture,Vannevar Labs,75000000
Albedo – Series A,Military Satellites,"Booz Allen Ventures, Cubit Capital, Bill Perkins, Breakthrough Energy Ventures, Energy Ventures, Shield Capital, Initialized Capital, Y Combinator, Giant Step Capital, Republic Capital",Series A,https://www.businesswire.com/news/home/20240123301939/en/Albedo-Raises-35M-to-Commercialize-Very-Low-Earth-Orbit-VLEO,Space Systems,2024-01-23,Early Stage Venture,Albedo,35000000
Chariot Defense – Seed,,"General Catalyst, XYZ Ventures, Cubit Capital, Ravelin, Forward Deployed VC, Pax Ventures, New Vista Capital, D3, Brave Capital",Seed,https://www.prnewswire.com/news-releases/chariot-defense-emerges-from-stealth-to-bridge-the-militarys-critical-battlefield-energy-and-power-gap-302506277.html,,2025-07-16,Seed,Chariot Defense,8000000
Red 6 – Series A,Training & Simulation,Snowpoint,Series A,https://www.prnewswire.com/news-releases/red-6-raises-30m-in-series-a-at-a-130m-post-cap-valuation-to-solve-national-security-gap-in-military-training-301302542.html,Support & Services,2021-06-01,Early Stage Venture,Red 6,30000000
Defense Unicorns – Series A,Defense Software,"Sapphire Venutures, Ansa Capital",Series A,https://www.businesswire.com/news/home/20240307277716/en/Defense-Unicorns-Raises-35-Million-Series-A-to-Advance-National-Security-through-Open-Source-Software,Software & IT Services,2024-03-07,Early Stage Venture,Defense Unicorns,35000000
World View – Strategic,Space-based Sensors & ISR,Breakthrough Victoria,Strategic,https://www.businesswire.com/news/home/20240430194762/en/World-View-Expands-into-Indo-Pacific-with-25M-Strategic-Investment,Space Systems,2024-05-02,Late Stage Venture,World View,25000000
Chaos – Series D,Radar Systems,,Series D,https://www.reuters.com/technology/counter-drone-radar-firm-chaos-raises-510-mln-defense-tech-boom-2025-11-13/,Electronic Systems,2025-11-13,Late Stage Venture,Chaos,510000000
Allen Control Systems – Seed,Small Arms & Light Weapons,"Craft Ventures, Forum Ventures, Rally Ventures",Seed,https://www.businesswire.com/news/home/20240418737342/en/Defense-Technology-Company-Allen-Control-Systems-Raises-12-Million-Seed-Capital-to-Build-Counter-Drone-Robotic-Gun-Systems,Weapon Systems,2024-04-18,Seed,Allen Control Systems,12000000
TEKEVER – Undisclosed,Unmanned Aerial Vehicles (UAVs),"Ventura Capital, Iberis Capital",Undisclosed,https://www.tekever.com/news/tekever-raises-20m-eur-for-global-expansion/,Platform Systems,2022-07-01,Miscellaneous,TEKEVER,20400000
Venus Aerospace – Series A,Military Aircraft,"Prime Movers Lab, Draper Associates, Boost VC, Saturn Five, Seraph Group, Cantos, The Helm & Tamarack Global",Series A,https://www.venusaero.com/venus-aerospace-raises-20-million-in-series-a-funding-led-by-prime-movers-lab/,Platform Systems,2022-04-04,Early Stage Venture,Venus Aerospace,20000000
True Anomaly – Series B,Military Satellites,"Riot Ventures, Eclipse, ACME Capital, Menlo Ventures, 645 Ventures, Narya, Rocketship.vc, Champion Hill Ventures, FiveNine Ventures",Series B,https://www.prnewswire.com/news-releases/true-anomaly-raises-100-million-in-series-b-funding-to-further-accelerate-growth-302012405.html,Space Systems,2023-12-12,Early Stage Venture,True Anomaly,100000000
Firestorm – Seed,Unmanned Aerial Vehicles (UAVs),"Lockheed Martin Ventures, Decisive Point, 645 Ventures, BVVC, Marque Ventures, Cubit Capital, IronGate Capital, Backswing Ventures, The Veteran Fund, Feld Ventures, Beyond Capital, Red Cat Holdings, Overmatch Ventures",Seed,https://www.prnewswire.com/news-releases/firestorm-labs-announces-12-5m-in-seed-funding-led-by-lockheed-martin-ventures-and-other-prominent-defense-vcs-302095517.html,Platform Systems,2024-03-21,Seed,Firestorm,12500000
ARX Robotics – Series A,Unmanned Ground Vehicles (UGVs),"HV Capital, Omnes Capital, NATO Innovations Fund, Project A",Series A,https://www.arx-robotics.com/journal/arx-robotics-raises-eu31m-series-a,Platform Systems,2025-04-28,Early Stage Venture,ARX Robotics,33170000
Conductor AI – Series A,Defense Software,"Lux Capital, Altman Capital, Haystack VC, Sunflower Capital, Humba Ventures, Also Capital, Forward Deployed VC, Abstract Ventures",Series A,https://www.businessinsider.com/startup-conductor-ai-raises-vc-funding-lux-capital-2025-4,Software & IT Services,2025-04-11,Early Stage Venture,Conductor AI,15000000
Second Front Systems – Series A,Defense Software,"Moore Strategic Ventures, AE Industrial Partners, Artis Venture, 8VC, Gula Tech Adventures, Abstract Ventures, Pallas Ventures, Gaingels, Kleiner Perkins",Series A,https://www.secondfront.com/resources/news/second-front-systems-raises-32-million-series-a/,Software & IT Services,2022-12-07,Early Stage Venture,Second Front Systems,32000000
Shield AI – Series D,Data Analytics & AI,"Disruptive, Point72 Ventures",Series D,https://shield.ai/shield-ai-raises-210-million-series-d-round/,Software & IT Services,2021-08-24,Late Stage Venture,Shield AI,210000000
Apex Space – Series C,Military Satellites,"Point72 Ventures, 8VC, Andreessen Horowitz (a16z), Washington Harbour Partners, StepStone Group",Series C,https://www.prnewswire.com/news-releases/apex-raises-200-million-in-series-c-funding-to-increase-productized-satellite-bus-manufacturing-302440649.html,Space Systems,2025-04-29,Late Stage Venture,Apex Space,200000000
Nominal – Series A,Defense Software,"General Catalyst, XYZ Ventures, Human Capital, Box Group, Overmatch Ventures, Haystack VC",Series A,https://www.businesswire.com/news/home/20240418799842/en/Nominal-Emerges-From-Stealth-With-Backing-From-General-Catalyst-Lux-Capital-Founders-Fund-for-Navigating-Mission-Critical-Data-Analytics,Software & IT Services,2024-04-22,Early Stage Venture,Nominal,20000000
Red 6 – SAFE,Training & Simulation,"Red Cell Partners, Snowpoint, Octave, Moonshots Capital, IronGate Capital, TR Aeroventures, Marlinspike",SAFE,https://www.prnewswire.com/news-releases/red-6-raises-7-million-in-safe-round-led-by-red-cell-snowpoint-and-octave-301237031.html,Support & Services,2021-03-01,Miscellaneous,Red 6,7000000
Saildrone – Series B,Maritime Systems,"The Schmidt Family Foundation, Capricorn",Series B,https://www.prnewswire.com/news-releases/saildrone-inc-raises-60-million-in-series-b-funding-to-scale-its-global-fleet-of-wind-powered-ocean-sailing-drones-and-accelerate-its-international-expansion-300647270.html,Platform Systems,2018-05-15,Early Stage Venture,Saildrone,60000000
Rebellion Defense – Series B,Defense Software,"Insight Partners, Venrock, Innovation Endeavors, Declaration Partners, Lupa Systems",Series B,https://www.axios.com/2021/09/15/rebellion-defense-raises-150-million-billion-valuation,Software & IT Services,2021-09-15,Early Stage Venture,Rebellion Defense,150000000
Merlin Labs – Series B,Military Aircraft,"Snowpoint, Baillie Gifford, Google Ventures",Series B,https://www.prnewswire.com/news-releases/autonomous-flight-company-merlin-labs-raises-105m-series-b-announces-partnership-with-usaf-301585960.html,Platform Systems,2022-07-13,Early Stage Venture,Merlin Labs,105000000
Gecko Robotics – Series D,"Maintenance, Repair, and Overhaul (MRO)","Cox Enterprises, Founders Fund, U.S. Innovative Technology Fund, Y Combinator, XN",Series D,https://www.geckorobotics.com/news/gecko-reaches-unicorn-status,Support & Services,2025-06-16,Late Stage Venture,Gecko Robotics,0
Anduril Industries – Series B,,"General Catalyst, Andreessen Horowitz (a16z), Founders Fund",Series B,https://www.generalcatalyst.com/stories/investing-in-defense,Software & IT Services,2019-10-03,Early Stage Venture,Anduril Industries,0
Aurelius  – Seed,Directed Energy Weapons,"General Catalyst, Draper Associates, Outlander VC, Squadra Ventures, Decisive Point, Alumni Ventures, New Founding, GoAhead Ventures, Detroit Venture Partners, EO Tech, Mana Ventures",Seed,https://www.businesswire.com/news/home/20250902984268/en/Aurelius-Systems-Raises-%2410-Million-to-Bring-Autonomous-Laser-Defense-to-the-Battlefield-In-Round-Led-by-General-Catalyst-Draper-Associates,Weapon Systems,2025-09-03,Seed,Aurelius ,10000000
Armada – Strategic,Data Analytics & AI,M12,Strategic,https://www.businesswire.com/news/home/20240711885904/en/Armada-Announces-40M-in-Strategic-Funding-Round-Led-by-M12,Software & IT Services,2024-07-11,Early Stage Venture,Armada,40000000
Hadrian – Series B,Manufacturing Support,"RTX Ventures, Construct Capital, WCM Investment Management, Bracket Capital, Shrug Capital, Lux Capital, Andreessen Horowitz (a16z), Founders Fund, Silent Venture, Caffeinated Capital, Tru Arrow",Series B,https://fortune.com/2024/10/29/hadrian-autonomous-factory-startup-andreessen-horowitz-new-cfo/,Support & Services,2024-02-21,Early Stage Venture,Hadrian,117000000
Anduril Industries – Series C,,"Andreessen Horowitz (a16z), Founders Fund",Series C,https://www.bloomberg.com/news/articles/2020-07-01/anduril-startup-backed-by-peter-thiel-is-valued-at-1-9-billion?cmpid%3D=socialflow-twitter-tech&embedded-checkout=true,Software & IT Services,2020-07-01,Late Stage Venture,Anduril Industries,200000000
Apex Space – Series B,Military Satellites,"CRV, Upfront, 8VC, Toyota Ventures, Point72 Ventures, Mirae Asset Capital, Outsiders Fund, GSBackers, Andreessen Horowitz (a16z), Shield Capital, J2 Ventures, Ravelin, Baiju Bhatt, Avalon Capital Group, XYZ Ventures",Series B,https://www.prnewswire.com/news-releases/apex-raises-95m-in-series-b-funding-to-increase-productized-satellite-bus-manufacturing-302170161.html,Space Systems,2024-06-12,Early Stage Venture,Apex Space,95000000
Impulse Space – Series C,Launch Services,"Linse Capital, DFJ Growth, Valor Equity, Founders Fund, Lux Capital, RTX Ventures, DCVC, Airbus, Spring Tide, First Principles Group, Balerion Space Ventures, Tamarack Global, Trousdale Ventures",Series C,https://www.impulsespace.com/updates/impulse-space-secures-300-million-dollar-series-c-to-accelerate-the-future-of-in-space-mobility,Space Systems,2025-06-03,Late Stage Venture,Impulse Space,300000000
Lodestar – Pre-Seed,"Maintenance, Repair, and Overhaul (MRO)","Inflection, Lunar Ventures",Pre-Seed,https://techcrunch.com/2024/07/25/lodestars-robotic-arm-is-an-orbital-first-responder-for-satellites-in-need/,Support & Services,2024-07-25,Seed,Lodestar,2500000
Firehawk Aerospace – Series B,Missiles & Guided Munitions,"Star Castle VC, Raytheon, Draper Associates, Goff Capital, Cathexis Ventures, Plains VC, Victorum Capital, Stellar Ventures, Capital Factory, Echo Investments, Hemisphere Ventures, Point Bridge Capital",Series B,https://www.linkedin.com/posts/firehawk-aerospace_firehawks-rocket-engines-and-3d-printed-activity-6980880586185863168-uaba/,Weapon Systems,2022-09-27,Early Stage Venture,Firehawk Aerospace,17800000
ActionStreamer – Series A,Communication Equipment,"JumpStart Ventures, Advanced Manufacturing Fund, The Castellini Management Company",Series A,https://www.prnewswire.com/news-releases/actionstreamer-raises-series-a-funding-to-accelerate-platform-development-302053764.html,Electronic Systems,2024-02-06,Early Stage Venture,ActionStreamer,2400000
Firefly – Undisclosed,Launch Services,Northrop Grumman Corporation,Undisclosed,https://fireflyspace.com/news/northrop-grumman-invests-50-million-in-firefly-aerospace-to-advance-medium-launch-vehicle-named-eclipse/,Space Systems,2025-05-29,Miscellaneous,Firefly,50000000
Anduril Industries – Series D,,"Elad Gil, Andreessen Horowitz (a16z), 8VC, Founders Fund, General Catalyst, Lux Capital, Valor Equity, D1 Capital Partners",Series D,https://blog.anduril.com/anduril-raises-450-million-in-series-d-funding-671f0a27876b,Software & IT Services,2021-06-17,Late Stage Venture,Anduril Industries,450000000
REGENT – Seed,Maritime Systems,"Founders Fund, Mark Cuban, Y Combinator, Caffeinated Capital, Thiel Capital, Jordan Noone, James Park",Seed,https://www.cnbc.com/2021/04/20/regent-raises-9-million-for-flying-ferries-with-180-mph-top-speed.html,Platform Systems,2021-04-20,Seed,REGENT,9000000
Delian – Series A,,"Air Street Capital, Marathon Venture Capital, 201, HCVC, Entropy Industrial Capital, Nebular",Series A,https://delian.ai/blog/series-a,,2025-07-29,Early Stage Venture,Delian,14000000
Poseidon Aerospace – Pre-Seed,Maritime Systems,"Starship Ventures, Draper Startup House",Pre-Seed,https://www.businessinsider.com/how-poseidon-plans-disrupt-logistics-with-uncrewed-sea-glider-2025-4,Platform Systems,2024-01-31,Seed,Poseidon Aerospace,1400000
Elroy Air – Seed,Unmanned Aerial Vehicles (UAVs),"Levitate Capital, Homebrew, Shasta Ventures, Lemnos",Seed,https://qz.com/1163960/delivery-drone-startup-elroy-air-announces-4-6-million-in-seed-funding-to-take-to-the-skies,Platform Systems,2017-12-22,Seed,Elroy Air,4600000
Edgerunner AI – Seed,Data Analytics & AI,Four Rivers Ventures,Seed,https://www.businesswire.com/news/home/20240718441467/en/EdgeRunner-AI-Emerges-from-Stealth-with-%245.5M-Seed-Funding-to-Build-Generative-AI-for-the-Edge,Software & IT Services,2024-07-18,Seed,Edgerunner AI,5500000
Hypori – Series B,Cybersecurity Solutions,"Moore Strategic Ventures, Hale Capital Partners, GreatPoint Ventures",Series B,https://www.hypori.com/news-and-media/hypori-series-b-2023,Software & IT Services,2023-03-29,Early Stage Venture,Hypori,23000000
Deepnight – Undisclosed,Data Analytics & AI,"Initialized Capital, Y Combinator",Undisclosed,https://www.globenewswire.com/news-release/2025/02/27/3034141/0/en/Deepnight-Raises-5-5M-To-Disrupt-Night-Vision-Industry-Using-AI.html,Software & IT Services,2025-02-27,Miscellaneous,Deepnight,5500000
Skydio – Series E,Unmanned Aerial Vehicles (UAVs),"Linse Capital, Andreessen Horowitz (a16z), Next47, IVP, DoCoMo, NVIDIA, UP.Partners, Hercules Capital, Axon",Series E,https://www.skydio.com/blog/skydio-raises-230-million-series-e-funding-round,Platform Systems,2023-02-27,Late Stage Venture,Skydio,230000000
Starfish Space – Series A,Military Satellites,"Munich Re Ventures, Toyota Ventures, PSL Ventures, NFX, MaC Venture Captial",Series A,https://www.geekwire.com/2023/starfish-space-14m-otter/,Space Systems,2023-03-08,Early Stage Venture,Starfish Space,14000000
Parrylabs – Strategic,Defense Software,"Capitol Meridian Partners, True Ventures, 3Wire Partners, Teamworthy Ventures",Strategic,https://www.prnewswire.com/news-releases/parry-labs-raises-80-million-from-capitol-meridian-partners-true-ventures-and-other-technology-investors-302232842.html,Software & IT Services,2024-08-28,Miscellaneous,Parrylabs,80000000
Infleqtion – Series C,,"Glynn Capital, Counterpoint Global, S32, SAIC, Axial, Breakthrough Victoria, Caruso Ventures, Cyfr Capital, Golden Vision Capital, Global Frontier, In-Q-Tel, LCP, Maverick, National Security Strategic Investment Fund (NSSIF), Olive Ventures, Overmatch Ventures, S Ventures, Wisconsin Alumni Research Foundation",Series C,https://infleqtion.com/infleqtion-raises-100m-to-scale-atom-based-quantum-solutions-for-national-security-and-next-generation-intelligent-systems/,,2025-06-02,Late Stage Venture,Infleqtion,100000000
Orbit Fab – Series A,Military Satellites,"8090 Industries, Stride Capital, Industrious Ventures, Lockheed Martin Ventures, Tribe Capital, Good Growth Capital, Massive Capital Partners",Series A,https://www.orbitfab.com/news/series-a/,Space Systems,2023-04-17,Early Stage Venture,Orbit Fab,28500000
FibreCoat – Series B,Advanced Materials,"NewSpace Capital, GOOSE Capital, NOVA, 212, Convergent Ventures, TiE Angels",Series B,https://spacenews.com/with-new-funding-fibrecoat-targets-space-and-defense-markets/,Support & Services,2024-12-05,Early Stage Venture,FibreCoat,20560000
Adranos Energetics – Series A,Missiles & Guided Munitions,"Bob Bishop, Explorer 1, Elevate Ventures, Specific Impulse Capital",Series A,https://www.businesswire.com/news/home/20220426005173/en/Adranos-Closes-%2420-Million-Series-A-Round,Weapon Systems,2022-04-26,Early Stage Venture,Adranos Energetics,20000000
Primer – Series C,Data Analytics & AI,"Addition, Steadfast Capital, Sands Capital, J2 Ventures, Crumpton Ventures, Amplify, Lux Capital, DCVC, Section 32, Bloomberg Beta, Avalon Capital Group",Series C,https://primer.ai/news/primer-raises-110m-series-c-to-accelerate-nlp-solutions-for-government-and-commercial-organizations/,Software & IT Services,2021-06-22,Late Stage Venture,Primer,110000000
Lovelace – Seed,Data Analytics & AI,RRE Ventures,Seed,https://www.prnewswire.com/news-releases/lovelace-ai-completes-seed-round-to-accelerate-data-fusion-technology-across-defense-and-commercial-sectors-302447287.html,Software & IT Services,2025-05-06,Seed,Lovelace,0
Starfish Space – Seed,Military Satellites,"NFX, MaC Venture Captial, PSL Ventures, Boost VC, Liquid2 Ventures, Hypothesis",Seed,https://www.prnewswire.com/news-releases/starfish-space-raises-7m-to-develop-the-otter-space-tug-301386463.html,Space Systems,2021-09-28,Seed,Starfish Space,7000000
Hypori – Extension,Cybersecurity Solutions,"UBS AG, Carahsoft Technology Group Corp., AE Industrial Partners",Extension,https://www.hypori.com/news-and-media/hypori-secures-strategic-series-b-extension-funding,Software & IT Services,2025-01-28,Early Stage Venture,Hypori,12000000
Grid Aero – Seed,Logistics & Supply Chain,,Seed,https://www.axios.com/2025/08/18/grid-aero-cargo-drone-stealth,Support & Services,,Seed,Grid Aero,6000000
Varda – Series A,Manufacturing Support,"Khosla Ventures, Caffeinated Capital, Lux Capital, General Catalyst, Founders Fund",Series A,https://blog.varda.com/p/varda-raises-42mm-series-a-to-build,Support & Services,2021-07-28,Early Stage Venture,Varda,42000000
Red 6 – Strategic,Training & Simulation,Lockheed Martin Ventures,Strategic,https://www.prnewswire.com/news-releases/red-6-secures-investment-from-lockheed-martin-ventures-301079548.html,Support & Services,2020-06-18,Miscellaneous,Red 6,0
Valstad – Pre-Seed,,"N49P, 10VC, Elementum, Northside Ventures",Pre-Seed,https://www.valstad.com/article/valstad-raises-2-6m-pre-seed-to-revive-american-shipbuidling,,2025-07-10,Seed,Valstad,2600000
Shift5 – Series C,Cybersecurity Solutions,"Hedosophia, Insight Partners, Center 15 Capital, 645 Ventures, Moore Strategic Ventures, Booz Allen Ventures, Squadra Ventures, AE Industrial Partners, Disruptive, CSP Equity Partners, Savano Capital Partners",Series C,https://shift5.io/shift5-raises-75-million-series-c/,Software & IT Services,2025-09-03,Late Stage Venture,Shift5,75000000
Shield AI – Strategic,Data Analytics & AI,"L3Harris, Hanwha Aerospace, U.S. Innovative Technology Fund, Andreessen Horowitz (a16z), Washington Harbour Partners",Strategic,https://www.prnewswire.com/news-releases/shield-ai-raises-240m-at-5-3b-valuation-to-scale-hivemind-enterprise-an-ai-powered-autonomy-developer-platform-302393843.html,Software & IT Services,2025-03-06,Late Stage Venture,Shield AI,240000000
Orbit Fab – Strategic,Military Satellites,8090 Industries,Strategic,https://spacenews.com/orbit-fab-secures-new-investor-to-support-satellite-refueling-efforts/,Space Systems,2022-10-25,Miscellaneous,Orbit Fab,0
Firestorm – Series A,Unmanned Aerial Vehicles (UAVs),"New Enterprise Associates, Decisive Point, Lockheed Martin Ventures, Washington Harbour Partners, Booz Allen Ventures",Series A,https://www.launchfirestorm.com/news/firestorm-raises-47m-to-scale-expeditionary-manufacturing,Platform Systems,2025-07-16,Early Stage Venture,Firestorm,35000000
Comand AI – Seed,Defense Software,"Eurazeo, Frst, Expeditions Fund",Seed,https://medium.com/@comand.ai/comand-ai-raises-8-5m-to-bring-decisive-military-superiority-to-france-and-its-allies-8a6ded3bbbff,Software & IT Services,2024-12-16,Seed,Comand AI,8800000
Proteus Space – Strategic,Military Satellites,SAIC,Strategic,https://www.linkedin.com/posts/proteus-space_aerospaceinnovation-ai-satellitetechnology-activity-7254431810753835008-clyY?utm_source=share&utm_medium=member_desktop&rcm=ACoAAAk_HOUBVRuNQld075fZp5ULmiAqfOZvVhM,Space Systems,2024-10-22,Miscellaneous,Proteus Space,0
Quantum Systems – Series C,,"Balderton Capital, Hensoldt, Airbus, Bullhound Capital, LP&E AG, HV Capital, Project A, Peter Thiel, DTCP, Omnes Capital, Notion, Porsche SE",Series C,https://quantum-systems.com/blog/2025/05/05/quantum-systems-raises-euro160m/,,2025-05-06,Late Stage Venture,Quantum Systems,181920000
Shift5 – Series A,Cybersecurity Solutions,"645 Ventures, Squadra Ventures, General Advance, First In",Series A,https://shift5.io/announcing-shift5s-series-a-funding/,Software & IT Services,2021-10-12,Early Stage Venture,Shift5,20000000
Divergent Technologies – Series C,Manufacturing Support,Hedosophia,Series C,https://www.prnewswire.com/news-releases/divergent-technologies-announces-160-million-series-c-funding-301532351.html,Support & Services,2022-04-25,Late Stage Venture,Divergent Technologies,160000000
Dream Security – Pre-Seed,Cybersecurity Solutions,"Aleph, Group 11",Pre-Seed,https://www.wsj.com/articles/ex-ceo-of-nso-group-raises-33-6-million-for-israeli-cyber-startup-ae8e7399,Software & IT Services,2022-01-01,Seed,Dream Security,21000000
Kela – Seed,Defense Software,Sequoia Capital,Seed,https://www.sequoiacap.com/article/partnering-with-kela-modern-defense-for-israel-and-western-allies/,Software & IT Services,2024-05-01,Seed,Kela,10000000
STARK – Undisclosed,Unmanned Aerial Vehicles (UAVs),"Sequoia Capital, Thiel Capital, NATO Innovations Fund, In-Q-Tel, Project A, Döpfner Capital, 8VC",Undisclosed,https://www.resiliencemedia.co/p/starks-62m-round-paints-a-stark-picture,Platform Systems,2025-08-29,Early Stage Venture,STARK,62000000
Droneforge – Seed,,"Outlander VC, First In, Tofino Capital, Shor Capital",Seed,https://www.linkedin.com/posts/chesterzelaya_announcing-droneforges-25m-pre-seed-led-activity-7351731672985321472-hz_H/,,2025-07-17,Seed,Droneforge,2500000
Hadrian – Series A,Manufacturing Support,"Lux Capital, Andreessen Horowitz (a16z), Lachy Groom, Caffeinated Capital, Founders Fund, Construct Capital, 137 Ventures",Series A,https://www.luxcapital.com/news/no-longer-tolerating-the-decline-of-american-industry,Support & Services,2022-03-31,Early Stage Venture,Hadrian,90000000
FibreCoat – Series A,Advanced Materials,"GOOSE Capital, Phoenix Venture Partners, b.value, TiE Angels, NOVA",Series A,https://fibrecoat.de/fibrecoat-closes-first-financing-round/,Support & Services,2021-11-17,Early Stage Venture,FibreCoat,3000000
TurbineOne – Seed,Data Analytics & AI,XYZ Ventures,Seed,https://www.businesswire.com/news/home/20220110005262/en/TurbineOne-Raises-%243-Million-to-Deliver-to-Ground-Forces-the-Information-They-Need-to-Navigate-Dangerous-Environments,Software & IT Services,2022-01-10,Seed,TurbineOne,3000000
Hypori – Series A,Cybersecurity Solutions,GreatPoint Ventures,Series A,https://www.businesswire.com/news/home/20210601005682/en/Hypori-Inc.-Secures-%2420-Million-in-Series-A-Financing-Led-by-GreatPoint-Ventures,Software & IT Services,2021-06-01,Early Stage Venture,Hypori,20000000
Wraithwatch – Seed,Cybersecurity Solutions,"Founders Fund, XYZ Ventures, Human Capital",Seed,https://www.wraithwatch.com/post/adapt-or-die-generative-ai-the-revolution-of-american-cyber-defense,Space Systems,2023-11-03,Seed,Wraithwatch,8000000
Hoverfly Technologies – Series B,,,Series B,https://www.prnewswire.com/news-releases/hoverfly-technologies-secures-20-million-series-b-investment-to-accelerate-growth-and-strengthen-us-drone-capabilities-302577305.html,,2025-10-08,Early Stage Venture,Hoverfly Technologies,20000000
Vannevar Labs – Series A,Defense Software,"Costanoa Ventures, Point72 Ventures, General Catalyst, Shield Capital",Series A,https://www.prnewswire.com/news-releases/vannevar-labs-announces-12m-series-a-funding-round-301362871.html,Software & IT Services,2021-08-25,Early Stage Venture,Vannevar Labs,12000000
Quantum Systems – Series C,,,Series C,https://www.tectonicdefense.com/quantum-systems-raises-e180m-at-e3b-valuation/,,2025-12-01,Late Stage Venture,Quantum Systems,209000000
Auterion – Series B,Defense Software,Bessemer Venture Partners,Series B,https://auterion.com/auterion-raises-130-million-series-b-as-their-ai-enabled-software-powering-low-cost-commercial-hardware-at-scale-transforms-warfare/,Software & IT Services,2025-09-23,Early Stage Venture,Auterion,130000000
Reveal – Series B,Data Analytics & AI,"Ballistic Ventures, Defy.VC, Booz Allen Ventures, Shield Capital, Next Frontier Capital, Madison Valley Partners",Series B,https://www.prnewswire.com/news-releases/reveal-technology-raises-30-million-series-b-led-by-ballistic-ventures-302515511.html,Software & IT Services,2025-07-29,Early Stage Venture,Reveal,30000000
Onebrief – Extension,Defense Software,Battery Ventures,Extension,https://www.businesswire.com/news/home/20250617330938/en/Onebrief-Reaches-%241.1-Billion-Valuation-with-%2420-Million-Series-C-Extension-Led-by-Battery-Ventures-Nearly-Doubling-in-3-Months,Software & IT Services,2025-06-16,Late Stage Venture,Onebrief,20000000
