Fundraising Round,Sector,Investors,Type (Stage),Announcement ,Category,Date,Stage,Company,Amount
Chaos – Series A,Radar Systems,"8VC, Alpha Wave Global, Lerner Enterprises, Tamarack Global, Valar Ventures, Liquid2 Ventures",Series A,https://news.crunchbase.com/venture/chaos-industries-defense-tech-anduril/,Electronic Systems,2023-03-06,Early Stage Venture,Chaos,70000000
Firefly – Series A,Launch Services,"DADA Holdings, Astera Institute, Canon Ball, Reuben Brothers Limited, SMS Capital Investment, Raven One Ventures, XBTO Ventures",Series A,https://fireflyspace.com/news/firefly-completes-oversubscribed-75m-series-a-and-100m-secondary-transaction/,Space Systems,2021-05-05,Early Stage Venture,Firefly,75000000
Saildrone – Series C,Maritime Systems,"Standard Investments, XN, BOND, Emerson Collective, Crowley Maritime Corporation, Lux Capital, Social Capital, Tribe Capital, Capricorn",Series C,https://www.saildrone.com/news/saildrone-advance-ocean-intelligence-series-c-funding,Platform Systems,2021-10-18,Late Stage Venture,Saildrone,100000000
Saildrone – Series A,Maritime Systems,,Series A,https://www.prnewswire.com/news-releases/saildrone-inc-raises-14-million-in-series-a-funding-to-expand-its-fleet-of-sailing-drones-and-ocean-data-services-300322444.html,Platform Systems,2016-09-05,Early Stage Venture,Saildrone,14000000
K2 Space – Series B,Military Satellites,"Lightspeed Venture Partners, Alpine Space Ventures, Altimeter Capital, First Round Capital",Series B,https://www.prnewswire.com/news-releases/k2-space-announces-110m-series-b-and-first-successful-in-space-demonstration-302375955.html,Space Systems,2025-02-13,Early Stage Venture,K2 Space,110000000
Andesite – Seed,Cybersecurity Solutions,"General Catalyst, Red Cell Partners",Seed,https://www.globenewswire.com/news-release/2025/02/11/3024316/0/en/Andesite-Raises-Additional-23-Million-and-Announces-General-Availability-of-the-Bionic-SOC.html,Software & IT Services,2025-02-11,Seed,Andesite,23000000
Darkhive – Series A,Unmanned Aerial Vehicles (UAVs),"Ten Eleven Ventures, Crosslink, RTX Ventures, Stellar Ventures",Series A,https://www.darkhive.com/post/defense-tech-startup-darkhive-secures-21-million-series-a-investment-led-by-ten-eleven-ventures,Platform Systems,2024-09-09,Early Stage Venture,Darkhive,21000000
ARX Robotics – Extension,Unmanned Ground Vehicles (UGVs),"Speedinvest, HV Capital",Extension,https://tech.eu/2025/07/29/arx-robotics-secures-eur11m-in-series-a-extension/,Platform Systems,2025-07-29,Early Stage Venture,ARX Robotics,12900000
REGENT – Strategic,Maritime Systems,"Thiel Capital, JAM Fund, Mesa Air Group, Toba Capital, Olive Tree Capital",Strategic,https://www.regentcraft.com/news/regent-raises-18m-from-strategic-investors-to-accelerate-development-of-its-full-scale-12-passenger-prototype,Platform Systems,2022-02-04,Miscellaneous,REGENT,18000000
CesiumAstro – Extension,Communication Equipment,"Trousdale Ventures, Development Bank of Japan, Quanta Computer, Kleiner Perkins, Lavrock Ventures, L3Harris Technologies, InMotion Ventures, Matter Venture Partners, MESH Ventures, Assembly Ventures",Extension,https://www.cesiumastro.com/press-release/cesiumastro-secures-65m-in-oversubscribed-funding-round,Electronic Systems,2024-06-18,Early Stage Venture,CesiumAstro,65000000
Re:Build – Undisclosed,Manufacturing Support,General Catalyst,Undisclosed,https://rebuildmanufacturing.com/news/general-catalyst-invests-in-rebuild-manufacturing/,Support & Services,2024-09-25,Miscellaneous,Re:Build,120000000
SEMPRE – Series A,Communication Equipment,"Pendrell, 90 Degree North",Series A,https://www.sempre.ai/news/sempre-closes-14-3m-series-a-with-additional-support-from-existing-investors-and-new-2m-investment-from-pendrell,Electronic Systems,2025-05-08,Early Stage Venture,SEMPRE,14300000
Saronic – Seed,Maritime Systems,"Silent Venture, Caffeinated Capital, 8VC, Andreessen Horowitz (a16z), Lightspeed Venture Partners, Point72 Ventures, U.S. Innovative Technology Fund, Cubit Capital",Seed,https://silentventures.medium.com/silent-ventures-backed-saronic-raises-55m-series-a-will-redefine-u-s-maritime-superiority-48fbf26f687b,Platform Systems,2023-01-01,Seed,Saronic,15000000
Hadrian – Seed,Manufacturing Support,"Lux Capital, Founders Fund, Construct Capital",Seed,https://techcrunch.com/2021/04/15/hadrian-is-building-the-factories-of-the-future-for-rocket-ships-and-advanced-manufacturing/,Support & Services,2021-04-01,Seed,Hadrian,9500000
Deterrence – Seed,Ammunition & Explosives,"Riot Ventures, Definition Capital, Impatient Ventures, Valhalla Ventures, Banter Capital, Dmitri Alperovitch",Seed,https://www.prweb.com/releases/deterrence-secures-10-1m-in-funding-to-automate-energetics-production-302329902.html,Weapon Systems,2024-12-12,Seed,Deterrence,10100000
Applied Intuition – Series B,Defense Software,"General Catalyst, Kleiner Perkins, Andreessen Horowitz (a16z), Lux Capital, Floodgate, M12, Sozo Ventures, La Famiglia",Series B,https://www.appliedintuition.com/news/series-b-announcement,Software & IT Services,2019-09-12,Early Stage Venture,Applied Intuition,40000000
Impulse Space – Strategic,Launch Services,Lux Capital,Strategic,https://www.impulsespace.com/updates/impulse-space-secures-dollar10m-from-lux-capital-rounding-out-recent-funding-to-dollar30m,Space Systems,2022-06-16,Miscellaneous,Impulse Space,10000000
Zeno Power – Series A,Power & Energy Systems,"Tribe Capital, Pallas Ventures, DCVC, AIN Ventures, 1517",Series A,https://www.pallasadvisors.com/post/pallas-ventures-invests-in-zeno-power-series-a,Support & Services,2022-04-28,Early Stage Venture,Zeno Power,20000000
Quantum Systems – Series B,,"Notion, Porsche SE, Peter Thiel, HV Capital, DTCP, Project A, Thiel Capital, ScaleUp Fonds Bayern, Omnes Capital, Airbus",Series B,https://quantum-systems.com/blog/2024/09/24/quantum-systems-increases-series-b-financing-volume/,,2024-09-24,Early Stage Venture,Quantum Systems,111320000
Auterion – Undisclosed,Defense Software,"Lakestar, Mosaic Ventures, Costanoa Ventures, Tectonic Ventures",Undisclosed,https://venturebeat.com/entrepreneur/auterion-raises-10-million-for-open-source-drone-operating-system/,Software & IT Services,2018-11-04,Miscellaneous,Auterion,10000000
ACUA Ocean – Pre-Seed,Maritime Systems,"StealthPoint, BritBots, Sixth Wave Ventures, Blue Action Accelerator",Pre-Seed,https://www.oceansciencetechnology.com/news/acua-ocean-receives-backing-to-develop-hydrogen-powered-usv/,Platform Systems,2024-12-11,Seed,ACUA Ocean,1900000
Dedrone – Extension,Electronic Warfare Systems,"Axon, Aqton Partners, Menlo Ventures, TargetPartners, Felicis",Extension,https://www.dedrone.com/press/dedrone-closes-30-million-series-c-1-financing,Electronic Systems,2022-07-13,Late Stage Venture,Dedrone,30000000
Foundation Alloy – Undisclosed,Advanced Materials,"Alumni Ventures, America's Frontier Fund, Engine Ventures, Intel Capital, Material Impact, Yamaha Motor Ventures",Undisclosed,https://www.foundationalloy.com/press-release-raise-with-aff,Support & Services,2025-05-07,Early Stage Venture,Foundation Alloy,7500000
Second Front Systems – Series C,Defense Software,"Battery Ventures, Salesforce Ventures, NEA, Moore Strategic Ventures, Artis Venture",Series C,https://www.secondfront.com/resources/blog/series-c-ceo-announcement/,Software & IT Services,2024-09-16,Late Stage Venture,Second Front Systems,70000000
Gecko Robotics – Series B,"Maintenance, Repair, and Overhaul (MRO)","Drive Capital, Founders Fund, Next47, Y Combinator, Mark Cuban, Josh Reeves, Jake Seid, Justin Kan, Gokul Rajaram, Paul Buchheit",Series B,https://www.prnewswire.com/news-releases/y-combinator-alum-gecko-robotics-raises-40-million-series-b-round-led-by-drive-capital-supporting-rapid-growth-in-industrial-inspection-robotics-300975388.html,Support & Services,2019-12-16,Early Stage Venture,Gecko Robotics,40000000
Ursa Major – Series D,Missiles & Guided Munitions,"Explorer 1, Eclipse, RTX Ventures",Series D,https://www.ursamajor.com/media/press-release/ursa-majors-dollar138m-boost-new-solid-rocket-motors-and-scaled-propulsion,Weapon Systems,2023-11-30,Late Stage Venture,Ursa Major,138000000
Antares – Series A,Power & Energy Systems,"AltCap, Caffeinated Capital, Rogue VC, Uncommon Captial, Shrug Capital, Banter Capital, Box Group, Shine Capital",Series A,https://antaresindustries.com/updates/antares-secures-30-million-series-a-to-accelerate-defense-space-and-industrial-focused-nuclear-energy,Support & Services,2024-10-30,Early Stage Venture,Antares,30000000
Radiant – Series B,,"Andreessen Horowitz (a16z), Founders Fund, Decisive Point, Cantos, Draper Associates, Boost VC, McKinley Alaska",Series B,https://radiantnuclear.com/blog/series-b/,,2023-04-24,Early Stage Venture,Radiant,40000000
Foundation Alloy – Seed,Advanced Materials,"The Engine and Material Impact, Safar Partners",Seed,https://www.forbes.com/sites/ariyanagriffin/2022/05/31/this-startup-raised-over-10-million-to-make-metal-manufacturing-more-efficient-and-sustainable/,Support & Services,2022-05-31,Seed,Foundation Alloy,10500000
TEKEVER – Undisclosed,Unmanned Aerial Vehicles (UAVs),"Ventura Capital, Baillie Gifford, NATO Innovations Fund, Iberis Capital, Crescent Cove Advisors",Undisclosed,https://www.tekever.com/news/tekever-confirmed-as-europes-newest-unicorn-as-it-invests-400m-in-the-uk-to-drive-ai-driven-defence/,Platform Systems,2025-05-06,Miscellaneous,TEKEVER,0
Proteus Space – Seed,Military Satellites,"Lavrock Ventures, The Veteran Fund, SAIC, Crosscut Ventures, Moonshots Capital",Seed,https://spacenews.com/proteus-achieves-breakthrough-in-automated-high-fidelity-structural-design-signs-first-commercial-payload-customer-and-secures-oversubscribed-6-1m-seed-2-funding/,Space Systems,2025-03-18,Seed,Proteus Space,6100000
Skydio – Seed,Unmanned Aerial Vehicles (UAVs),Andreessen Horowitz (a16z),Seed,https://cdixon.org/2015/01/15/skydio,Platform Systems,2015-01-15,Seed,Skydio,3000000
Vector – Series A,,"Pelion Venture Partners, Harpoon Ventures, Point72 Ventures, Lightspeed Venture Partners, Run Ventures, Dauntless Ventures, GSBackers, Alumni Ventures, Kickstart Fund, Shield Capital, R7, Cambria Group, Stony Lonesome Group",Series A,https://presswire.com/release/vector-announces-closing-of-series-a-financing-round-61-million-raised-in-14-month-push/,,2025-09-03,Early Stage Venture,Vector,61000000
Sphinx – Strategic,Cybersecurity Solutions,Block 3,Strategic,https://www.block3.us/news-post,Software & IT Services,2024-11-18,Miscellaneous,Sphinx,0
Urban Sky – Series B,Military Satellites,"Altos Ventures, New Legacy Ventures, Lerer Hippeau, Catapult Ventures, Lavrock Ventures, New Stack Ventures, TenOneTen, DA Ventures, Union Labs VC, Techstars Ventures",Series B,https://www.urbansky.com/post/urban-sky-raises-30-million-in-series-b-funding-to-unlock-routine-and-easy-global-access-to-the-str,Space Systems,2025-02-06,Early Stage Venture,Urban Sky,30000000
Overwatch Imaging – Undisclosed,Radar Systems,"Squadra Ventures, SEMCAP AI, Elevate Oregon Venture Direct Fund, Edo Capital",Undisclosed,https://www.overwatchimaging.com/post/overwatch-imaging-secures-6m-in-venture-funding,Electronic Systems,2025-07-15,Miscellaneous,Overwatch Imaging,6000000
Capella Space – Series B,Space-based Sensors & ISR,"Spark Capital, DCVC, Mark VC, Harmony Partners",Series B,https://www.capellaspace.com/press-releases/capella-space-closes-19m-series-b-to-deliver-reliable-earth-observation-data-on-demand,Space Systems,2018-09-26,Early Stage Venture,Capella Space,19000000
Solideon – Pre-Seed,Manufacturing Support,"8090 Industries, 1517, Stellar Ventures, Boost VC, 10X Founders, Pathbreaker Ventures, AIN Ventures, Tiny VC, MD One Ventures, Reinforced Ventures, Techstars Space, Capital Factory, Vibe Capital, Gaingels",Pre-Seed,https://www.accessnewswire.com/newsroom/en/industrial-and-manufacturing/solideon-oversubscribes-pre-seed-goals-advances-vision-for-future-manuf-889960,Support & Services,2024-07-17,Seed,Solideon,5000000
Spinlaunch – Undisclosed,Launch Services,"ATW Partners, Kongsberg Defence & Aerospace",Undisclosed,https://www.businesswire.com/news/home/20250818553463/en/SpinLaunch-Announces-Closing-of-%2430M-in-Funding-to-Accelerate-the-Development-of-the-Meridian-Space-Constellation,Space Systems,2025-08-18,Late Stage Venture,Spinlaunch,30000000
Obviant – Undisclosed,,"Shield Capital, Motivate Venture Capital, A*, New Vista Capital, Aloft VC, Underdog Labs",Undisclosed,https://www.obviant.com/blog/obviant-raises-7-1m-in-funding-to-scale-its-data-intelligence-platform-for-defense-acquisition-contracting-and-budgeting,Support & Services,2025-06-24,Seed,Obviant,7100000
Rune Technologies – Series A,Defense Software,"Human Capital, Pax Ventures, Washington Harbour Partners, Andreessen Horowitz (a16z), Point72 Ventures, XYZ Ventures, Forward Deployed VC",Series A,https://www.businesswire.com/news/home/20250721838717/en/Rune-Technologies-Closes-%2424M-Series-A-to-Deploy-AI-Enabled-Software-for-Military-Logistics,Software & IT Services,2025-07-22,Early Stage Venture,Rune Technologies,24000000
Usul – Seed,Consulting & Engineering Services,"Scout Ventures, Bravo Victor Venture Capital, Y Combinator, Steve Blank, Peter Newell, Jack Shanahan, Jacqueline Tame",Seed,https://www.tectonicdefense.com/exclusive-usul-raises-3-3m-to-help-companies-win-defense-contracts/,Support & Services,2025-05-12,Seed,Usul,3300000
Armada – Strategic,Data Analytics & AI,"Pinegrove, Veriten, Glade Brook, Founders Fund, Lux Capital, Shield Capital, 8090 Industries, M12, Overmatch Ventures, Silent Venture, Felicis, Marlinspike",Strategic,https://www.prnewswire.com/news-releases/armada-announces-131m-strategic-funding-round-launch-of-megawatt-scale-modular-ai-data-centers-to-accelerate-american-energy-and-ai-dominance-302513137.html,Software & IT Services,2025-07-24,Miscellaneous,Armada,131000000
Anduril Industries – Series G,,Founders Fund,Series G,https://www.bloomberg.com/news/articles/2025-06-05/defense-startup-anduril-cllinches-funding-at-30-5-billion-valuation,Software & IT Services,2025-06-05,Late Stage Venture,Anduril Industries,2500000000
Fortem Technologies – Undisclosed,Electronic Warfare Systems,"Lockheed Martin Ventures, Hanwha Aerospace, Crumpton Ventures, DCVC, Signia Venture Partners",Undisclosed,https://www.prnewswire.com/news-releases/fortem-technologies-closes-17-8m-in-funding-round-to-scale-airspace-safety-and-security-capabilities-301752008.html,Electronic Systems,2023-02-21,Miscellaneous,Fortem Technologies,17800000
Mach Industries – Seed,Unmanned Aerial Vehicles (UAVs),Sequoia Capital,Seed,https://www.reuters.com/technology/sequoia-makes-first-defense-tech-investment-mach-industries-2023-06-15/,Platform Systems,2023-06-16,Seed,Mach Industries,5700000
Fortem Technologies – Strategic,Electronic Warfare Systems,LAGO Innovation Fund,Strategic,https://fortemtech.com/press-releases/2024-11-13-lago-innovation-fund-facilitates-10mm-investment-in-fortem-technologies-to-support-demand-for-drone-defense-solutions/,Electronic Systems,2024-11-13,Miscellaneous,Fortem Technologies,10000000
HawkEye 360 – Strategic,Space-based Sensors & ISR,Leidos,Strategic,https://www.he360.com/hawkeye-360-adds-leidos-as-investor-to-bring-series-d-round-to-150-million/,Space Systems,2022-01-06,Late Stage Venture,HawkEye 360,5000000
Rocket Lab – Series E,Launch Services,"Future Fund, Greenspring Associates, Khosla Ventures, Bessemer Venture Partners, Promus Ventures, K1W1 investment fund, ACC",Series E,https://www.rocketlabusa.com/updates/rocket-lab-announces-140-million-in-new-funding/,Space Systems,2018-11-15,,Rocket Lab,140000000
Impulse Space – Series B,Launch Services,"Founders Fund, Lux Capital, Spring Tide, DCVC, Airbus, Alumni Ventures, Balerion Space Ventures, RTX Ventures, Tamarack Global, 137 Ventures, Elysium, First Principles Group, Island Green, Overmatch Ventures, Trousdale Ventures",Series B,https://www.impulsespace.com/updates/impulse-space-secures-dollar150m-in-series-b-funding-to-support-ongoing-company-momentum,Space Systems,2024-10-01,Early Stage Venture,Impulse Space,150000000
Vatn Systems – Seed,Maritime Systems,"DYNE Ventures, Lockheed Martin Ventures, RTX Ventures, In-Q-Tel, Propeller Ventures, SAIC, Cubit Capital, Fortitude Ventures, Centre Street Partners, The Veteran Fund, Blue Collective, Decisive Point",Seed,https://www.prnewswire.com/news-releases/vatn-systems-raises-13-million-seed-round-to-advance-autonomous-underwater-vehicles-for-us-defense-302301937.html,Platform Systems,2024-11-12,Seed,Vatn Systems,13000000
Shift5 – Series B,Cybersecurity Solutions,"Moore Strategic Ventures, Booz Allen Ventures",Series B,https://www.axios.com/2023/06/07/defense-contractor-shift5-closes-83m-series-b-round,Software & IT Services,2023-06-07,Early Stage Venture,Shift5,83000000
Andrenam – Seed,,"First Round Capital, Also Capital, Long Journey, 201, Banter Capital, Homebrew, Wavefunction, Colorado School of Mines Venture Fund",Seed,https://www.andrenam.com/andrenam-raises-10m,,2025-06-16,Seed,Andrenam,10000000
PiLogic – Seed,,"Scout Ventures, Seraphim Space Investment Trust, Sovereign's Capital, Flex Capital, FN Fund, Gokul Rajaram",Seed,https://spacenews.com/pilogic-raises-4-million-for-bespoke-satellite-ai-models/,,2025-05-22,Seed,PiLogic,4000000
Hive Robotics – Pre-Seed,,"b2venture, firedrop VC, Pareto, Klocke Group",Pre-Seed,https://www.hive-robotics.com/,,2025-09-12,Seed,Hive Robotics,2347140
Nooks – Series A,,"Zigg Capital, Upper90, SAIC, Lockheed Martin Ventures",Series A,https://nooks.works/25M-Series-A/,,2025-06-09,Early Stage Venture,Nooks,25000000
Epirus – Series D,Electronic Warfare Systems,"8VC, Washington Harbour Partners, Oppenheimer, NightDragon, Manhattan Venture Partners, Centaurus Capital LP, Center15 Capital, General Dynamics Land Systems, StepStone Group, Gaingels",Series D,https://www.epirusinc.com/press-releases/epirus-closes-250m-series-d-to-hyperscale-leonidas-production-capability-for-critical-asset-protection,Electronic Systems,2025-03-05,Late Stage Venture,Epirus,250000000
Helsing – Series C,Data Analytics & AI,"General Catalyst, Elad Gil, Accel, Saab, Lightspeed Venture Partners, Plural, Greenoaks",Series C,https://helsing.ai/newsroom/helsing-further-strengthens-european-defence-capabilities-with-funding-round,Software & IT Services,2024-07-10,Late Stage Venture,Helsing,487000000
Gastops – Undisclosed,,RTX Ventures,Undisclosed,https://www.gastops.com/news-resources/gastops-receives-investment-from-rtx-for-next-generation-monitoring-technologies/,,2025-05-28,Miscellaneous,Gastops,0
Esper Satellite Imagery – Seed,Space-based Sensors & ISR,"Paspalis Capital, Hejaz",Seed,https://payloadspace.com/esper-satellites-raises-3-1m-seed-round/,Space Systems,2025-03-04,Seed,Esper Satellite Imagery,3100000
Gecko Robotics – Series C,"Maintenance, Repair, and Overhaul (MRO)","U.S. Innovative Technology Fund, Founders Fund, XN, XYZ Ventures, Drive Capital, Snowpoint, Joe Lonsdale, Mark Cuban, Gokul Rajaram",Series C,https://www.geckorobotics.com/news/gecko-robotics-raises-usd100-million-to-extend-its-series-c-funding-enabling,Support & Services,2023-12-05,Late Stage Venture,Gecko Robotics,173000000
Saronic – Series C,Maritime Systems,"Elad Gil, General Catalyst, Andreessen Horowitz (a16z), 8VC, Caffeinated Capital",Series C,https://www.prnewswire.com/news-releases/saronic-raises-600m-series-c-to-take-on-autonomous-shipbuilding-302379441.html,Platform Systems,2025-02-18,Late Stage Venture,Saronic,600000000
Orbital Operations – Seed,Launch Services,"Initialized Capital, Harpoon Ventures, DTX Ventures, Rebel Fund, TRAC VC, Karman Ventures, Immad Akhund",Seed,https://payloadspace.com/orbital-operations-raises-8-8m-for-high-thrust-orbital-vehicle/,Space Systems,2025-08-07,Seed,Orbital Operations,8800000
Skydio – Series D,Unmanned Aerial Vehicles (UAVs),"Andreessen Horowitz (a16z), Linse Capital, IVP, Next47, UP.Partners",Series D,https://www.skydio.com/blog/autonomous-drone-skydio-announces-170-million-series-d-funding,Platform Systems,2021-03-01,Late Stage Venture,Skydio,170000000
Second Front Systems – Seed,Defense Software,"8VC, Artis Venture, Abstract Ventures, Kleiner Perkins, Gula Tech Adventures, Pallas Ventures",Seed,https://www.secondfront.com/resources/news/seed-round-2021/,Software & IT Services,2021-01-27,Seed,Second Front Systems,8100000
Schemata – Seed,,"Owl Ventures, Anorak Ventures, Andreessen Horowitz (a16z), Alumni Ventures, Time Zero Capital",Seed,https://www.linkedin.com/posts/jamesbrn_funding-announcement-excited-to-announce-activity-7330249780444413953-4SLS?utm_source=share&utm_medium=member_desktop&rcm=ACoAAAk_HOUBVRuNQld075fZp5ULmiAqfOZvVhM,,2025-05-14,Seed,Schemata,5000000
EpiSci – Pre-Seed,Data Analytics & AI,"Decisive Point, Lockheed Martin Ventures, RTX Ventures, Top Aces",Pre-Seed,https://www.episci.com/newsroom/z70zktrf3b7d8g38o3cwosorx12fq1,Software & IT Services,2023-04-20,Seed,EpiSci,0
Epirus – Series C,Electronic Warfare Systems,"T. Rowe Price Associates, Inc., 8VC, Bedrock, Broom Ventures, EPIQ Capital Group, General Dynamics Land Systems, Gaingels, I Squared Capital, Moore Strategic Ventures, Parkwood, Piedmont Capital Investments, Red Cell Partners, StepStone Group",Series C,https://www.epirusinc.com/press-releases/epirus-raises-200-million-in-series-c-funding,Electronic Systems,2022-02-15,Late Stage Venture,Epirus,200000000
Durin – Pre-Seed,Manufacturing Support,"8090 Industries, Andreessen Horowitz (a16z), 1517, Bedrock, Champion Hill Ventures, Contrary, Day One Ventures, Lux Capital",Pre-Seed,https://techcrunch.com/2025/04/23/durin-digs-up-3-4m-to-automate-drills-for-critical-minerals-exploration/,Support & Services,2025-04-23,Seed,Durin,3400000
Firehawk Aerospace – Series C,Missiles & Guided Munitions,"Czechoslovak Group, 1789 Capital, Presto Tech Horizons",Series C,https://firehawkaerospace.com/firehawk-oversubscribes-60m-investment-round-and-gains-a-strategic-european-investor-strengthens-allied-defense-supply-chain-resilience/,Weapon Systems,2025-09-24,Late Stage Venture,Firehawk Aerospace,60000000
Cambium – Series A,Advanced Materials,"Veteran Ventures, 8VC, GSBackers, Marlinspike, MVP Ventures, Gaingels, Kern Venture Fund, Jackson Moses, Vertical Capital",Series A,https://www.cambium-usa.com/wp-content/uploads/2023/12/Cambium-Series-A-announcement.pdf,Support & Services,2023-12-05,Early Stage Venture,Cambium,19000000
Galvanick – Seed,Cybersecurity Solutions,"MaC Venture Captial, Founders Fund, Village Global, Countdown Capital, Hanover Technology Investment Management, Shrug Capital, 8090 Industries, Silent Venture",Seed,https://www.businesswire.com/news/home/20230601005184/en/Galvanick-Announces-%2410-Million-in-Seed-Funding-for-Its-Industrial-Cybersecurity-Platform,Software & IT Services,2023-06-01,Seed,Galvanick,10000000
Skydio – Series C,Unmanned Aerial Vehicles (UAVs),"Next47, DoCoMo, Levitate Capital, Andreessen Horowitz (a16z), IVP, Playground",Series C,https://www.skydio.com/blog/skydio-raises-100-million,Platform Systems,2020-07-13,Late Stage Venture,Skydio,100000000
Nominal – Seed,Defense Software,"Lux Capital, Founders Fund",Seed,https://www.businesswire.com/news/home/20240418799842/en/Nominal-Emerges-From-Stealth-With-Backing-From-General-Catalyst-Lux-Capital-Founders-Fund-for-Navigating-Mission-Critical-Data-Analytics,Software & IT Services,2024-04-22,Seed,Nominal,7500000
Antares – Seed,Power & Energy Systems,"Caffeinated Capital, Humba Ventures, Pathbreaker Ventures, Rogue VC, Shrug Capital, Uncommon Captial",Seed,https://antaresindustries.com/updates/antares-announces-8m-seed-round,Support & Services,2023-10-31,Seed,Antares,8000000
Dream Security – Series A,Cybersecurity Solutions,"Aleph, Group 11",Series A,https://www.wsj.com/articles/ex-ceo-of-nso-group-raises-33-6-million-for-israeli-cyber-startup-ae8e7399,Software & IT Services,2023-11-07,Early Stage Venture,Dream Security,33600000
Divergent Technologies – Series D,Manufacturing Support,Hexagon AB,Series D,https://www.prnewswire.com/news-releases/divergent-technologies-inc-announces-closing-of-upsized-230-million-series-d-capital-raise-301985962.html,Support & Services,2023-11-13,Late Stage Venture,Divergent Technologies,230000000
Saronic – Series A,Maritime Systems,"Caffeinated Capital, 8VC, U.S. Innovative Technology Fund, Andreessen Horowitz (a16z), Lightspeed Venture Partners, Point72 Ventures, Silent Venture, Overmatch Ventures, Ensemble VC, Cubit Capital",Series A,https://www.prnewswire.com/news-releases/naval-maritime-autonomy-company-raises-55-million-in-series-a-fundraise-301951085.html,Platform Systems,2023-10-10,Early Stage Venture,Saronic,55000000
Elroy Air – Undisclosed,Unmanned Aerial Vehicles (UAVs),Shield Capital,Undisclosed,https://www.cooley.com/news/coverage/2024/2024-02-08-elroy-air-announces-nearly-50-million-in-new-funding,Platform Systems,2024-02-08,Miscellaneous,Elroy Air,0
Allen Control Systems – Series A,Small Arms & Light Weapons,"Craft Ventures, Inspired Capital, Rally Ventures",Series A,https://www.businesswire.com/news/home/20250326066567/en/Allen-Control-Systems-Raises-%2430-Million-Series-A-to-Accelerate-Deployment-of-Autonomous-Weapon-Systems-and-Counter-Rapidly-Proliferating-Drone-Threat,Weapon Systems,2025-03-27,Early Stage Venture,Allen Control Systems,30000000
Reveal – Series A,Data Analytics & AI,"Next Frontier Capital, Defy.VC, 8VC",Series A,https://techcrunch.com/2024/12/11/reveal-technology-raises-11m-to-scale-decision-dominance-tools-for-dod/,Software & IT Services,2024-12-11,Early Stage Venture,Reveal,11200000
