Fundraising Round,Sector,Investors,Type (Stage),Announcement ,Category,Date,Stage,Company,Amount
Primer – Series D,Data Analytics & AI,"Addition, U.S. Innovative Technology Fund",Series D,https://primer.ai/news/primer-announces-69m-in-funding-to-accelerate-ai-enabled-information-advantage/,Software & IT Services,2023-06-14,Late Stage Venture,Primer,69000000
Danti – Seed,Data Analytics & AI,"Shield Capital, Tech Square Ventures, Humba Ventures, Leo Polovets, Space VC, Radius Capital",Seed,https://danti.ai/danti-raises-5m-to-deploy-its-ai-data-analyst/,Software & IT Services,2024-05-02,Seed,Danti,5000000
Shield AI – Series B,Data Analytics & AI,"Silicon Valley Bank, Riot Ventures",Series B,https://web.archive.org/web/20210124051459/https://www.shield.ai/content/2019/8/13/on-reaching-new-milestones,Software & IT Services,2019-08-13,Early Stage Venture,Shield AI,0
Shift5 – Seed,Cybersecurity Solutions,"Lamphere Capital, Outlander VC, Nue Capital, Emerging Ventures",Seed,https://pulse2.com/shift5-2-5-million-funding/,Software & IT Services,2019-09-18,Seed,Shift5,2500000
Valarian – Seed,Cybersecurity Solutions,"Scout Ventures, Artis Venture, Gokul Rajaram",Seed,https://www.prnewswire.co.uk/news-releases/valarian-emerges-from-stealth-with-20m-in-seed-funding-launches-valarian-defence-amid-global-infrastructure-shift-302449126.html,Software & IT Services,2025-05-08,Seed,Valarian,20000000
Venus Aerospace – Seed,Military Aircraft,"Prime Movers Lab, Draper Associates, Boost VC, Saturn Five, X-Factor Ventures",Seed,https://www.venusaero.com/venus-aerospace-closes-on-3-million-in-seed-funding/,Platform Systems,2021-03-03,Seed,Venus Aerospace,3000000
Origin Robotics – Pre-Seed,Unmanned Aerial Vehicles (UAVs),"Change Ventures, Silicon Roundabout Ventures",Pre-Seed,https://siliconcanals.com/origin-robotics-secures-e4m-in-pre-seed-funding/,Platform Systems,2024-10-28,Seed,Origin Robotics,2600000
Radiant – Series C,,"DCVC, Giant Ventures Global, StepStone Group, Hanwha Aerospace, SGA, Crossbeam Venture Partners, Align Ventures, ARK Venture Fund, Gigascale Capital, HartBeat Ventures, Pax Ventures",Series C,https://www.radiantnuclear.com/blog/series-c-close/,,2025-05-28,Late Stage Venture,Radiant,165000000
Neros – Series A,Unmanned Aerial Vehicles (UAVs),"Vy Capital US, Sequoia Capital, Interlagos, D3, Keller Rinaudo Cliffton",Series A,https://medium.com/@sorenma/neros-raises-35m-series-a-to-accelerate-american-drone-manufacturing-be1aa3e1a4d4,Platform Systems,2025-03-17,Early Stage Venture,Neros,35000000
Helsing – Series B,Data Analytics & AI,"General Catalyst, Saab",Series B,https://helsing.ai/newsroom/helsing-raises-euro209m-series-b-to-bolster-defence-ai-capabilities-for-democracies,Software & IT Services,2023-09-13,Early Stage Venture,Helsing,223000000
Cape – Undisclosed,Communication Equipment,"A*, Andreessen Horowitz (a16z), ex/ante, Costanoa Ventures, XYZ Ventures, Point72 Ventures, Forward Deployed VC, Karman Ventures",Undisclosed,https://www.businesswire.com/news/home/20240418101671/en/Cape-Raises-61M-to-Build-Ultra-Private-and-Secure-Mobile-Carrier,Electronic Systems,2024-04-18,Early Stage Venture,Cape,61000000
Scale AI – Series F,Data Analytics & AI,"Y Combinator, Nat Friedman, Index Ventures, Founders Fund, Coatue, Thrive Capital, Spark Capital, NVIDIA, Tiger Global Management, Greenoaks, Wellington Management, Cisco Investments, DFJ Growth, Intel Capital, ServiceNow Ventures, WCM Investment Management, Amazon, Elad Gil, AMD Ventures, Qualcomm Ventures",Series F,https://scale.com/blog/scale-ai-series-f,Software & IT Services,2024-05-21,Late Stage Venture,Scale AI,1000000000
CesiumAstro – Series B,Communication Equipment,"Airbus, Forever Ventures, L3Harris Technologies, Kleiner Perkins, Lavrock Ventures, Franklin Blackhorse Fund, HEICO",Series B,https://www.cesiumastro.com/press-release/cesiumastro-secures-60-million-in-oversubscribed-series-b-funding,Electronic Systems,2022-03-20,Early Stage Venture,CesiumAstro,60000000
Valthos – Seed,,,Seed,https://valthos.com/blog/intro,,2025-10-24,Seed,Valthos,30000000
Red 6 – Series B,Training & Simulation,"RedBird Capital Partners, Alpha Edison, AEI HorizonX, Lockheed Martin Ventures, Accelerator Investments, Washington Harbour Partners, M-Cor Holdings, Moonshots Capital, IronGate Capital, State of Florida Opportunity Fund, Alumni Ventures, Alliance Holdings, Alcazar Capital, Downey Labs",Series B,https://www.prnewswire.com/news-releases/red-6-completes-70-million-series-b-fundraising-to-amplify-augmented-reality-technology-designed-for-military-training-301840465.html,Support & Services,2023-06-01,Early Stage Venture,Red 6,70000000
Rocket Lab – Series A,Launch Services,Khosla Ventures,Series A,https://www.rocketlabusa.com/updates/rocket-lab-secures-a-round-funding-from-khosla-ventures/,Space Systems,2013-10-01,Early Stage Venture,Rocket Lab,0
Skydio – Series B,Unmanned Aerial Vehicles (UAVs),"IVP, Playground, NVIDIA, Accel, Kevin Durant",Series B,https://techcrunch.com/2018/02/13/skydios-2499-self-flying-drone-knows-where-you-are-and-where-youre-going/,Platform Systems,2018-02-01,Early Stage Venture,Skydio,42000000
D-Fend Solutions – Series C,Electronic Warfare Systems,"Israel Growth Partners, Vertex Ventures, Vertex Growth",Series C,https://d-fendsolutions.com/press_releases/d-fend-solutions-raises-31m-to-fortify-cyber-counter-drone-technology-and-market-leadership/,Electronic Systems,2024-12-04,Late Stage Venture,D-Fend Solutions,31000000
CX2 – Seed,Electronic Warfare Systems,"8VC, Andreessen Horowitz (a16z)",Seed,https://www.forbes.com/sites/davidjeans/2024/06/06/secret-electronic-warfare-startup-a16z-8vc/,Electronic Systems,2024-06-06,Seed,CX2,15000000
Picogrid – Seed,Defense Software,"Initialized Capital, Starburst Ventures, Credo Ventures, Giant Step Capital, Domino Ventures, Alumni Ventures",Seed,https://picogrid.com/newsroom/picogrid-raises-12m-seed-round-to-connect-defense-systems,Software & IT Services,2024-03-26,Seed,Picogrid,12000000
Dream Security – Series B,Cybersecurity Solutions," Bain Capital Ventures, Group 11, Tru Arrow, Tau Capital, Aleph",Series B,https://www.businesswire.com/news/home/20250217135636/en/Dream-the-First-AI-Company-for-National-Cybersecurity-Raises-100M-to-Defend-Nations-and-Critical-Infrastructure,Software & IT Services,2025-02-17,Early Stage Venture,Dream Security,100000000
XRF.ai – Undisclosed,Training & Simulation,"JME Ventures, Kfund, GoHub Ventures",Undisclosed,https://www.xrf.ai/newsroom/xrf-secures-e2-3-million-to-accelerate-ai-and-xr-development-for-defense-and-security/,Support & Services,2024-09-26,Seed,XRF.ai,2500000
Orca AI – Series B,,"OCV Partners, Mizmaa Ventures, Brighton Park Capital, Ankona Capital, Hyperlink Ventures",Series B,https://www.orca-ai.io/resource/orca-ai-secures-72-5-million-investment-to-scale-autonomous-shipping-solutions/,,2025-05-06,Early Stage Venture,Orca AI,72500000
Perseus Defense – Seed,,"Alumni Ventures, Bow Capital, Multimodal Ventures, Lobster Capital , Rebel Fund, Pioneer Fund",Seed,https://www.tectonicdefense.com/exclusive-yc-backed-perseus-defense-closes-6m-seed-round/,,2025-09-18,Seed,Perseus Defense,6000000
Shield AI – Series E,Data Analytics & AI,"Snowpoint, Riot Ventures, Disruptive, Homebrew",Series E,https://shield.ai/shield-ai-boosts-series-e/,Software & IT Services,2022-12-14,Late Stage Venture,Shield AI,150000000
Privateer – Series A,Space-based Sensors & ISR,"Aero X Ventures, Lux Capital, BOKA Group, Starburst Ventures, Cameron Winklevoss, Tyler Winklevoss",Series A,https://www.reuters.com/markets/deals/wozniaks-space-firm-privateer-buys-orbital-insight-raises-565-million-2024-05-06/,Space Systems,2024-04-17,Early Stage Venture,Privateer,56500000
AIR – Series A,,"Dr. Shmuel Harlap, Entrée Capital",Series A,https://techcrunch.com/2025/07/30/air-secures-23m-to-boost-u-s-expansion-and-evtol-innovation/,,2025-07-30,Early Stage Venture,AIR,23000000
Capella Space – Series C,Space-based Sensors & ISR,"NightDragon, DCVC, Cota Capital",Series C,https://www.capellaspace.com/press-releases/capella-space-closes-97m-series-c-financing-round-to-meet-exponential-customer-demand-for-its-radar-powered-high-quality-satellite-imagery-and-intelligence,Space Systems,2022-04-25,Late Stage Venture,Capella Space,97000000
Hadrian – Series C,Manufacturing Support,"Founders Fund, Lux Capital, Morgan Stanley, Altimeter, 1789 Capital, Andreessen Horowitz (a16z), Construct Capital, 137 Ventures",Series C,https://x.com/2112Power/status/1945888686203125912,Support & Services,2025-07-17,Late Stage Venture,Hadrian,260000000
Hidden Level – Series C,Radar Systems,"DFJ Growth, Booz Allen Ventures, Revolution Growth, Costanoa Ventures, Washington Harbour Partners, Veteran Ventures, Founders Circle Capital",Series C,https://www.hiddenlevel.com/thought-leadership/hidden-level-secures-100m-to-advance-national-security,Electronic Systems,2025-02-03,Late Stage Venture,Hidden Level,65000000
Hermeus – Series A,Military Aircraft,"Canaan Partners, Khosla Ventures, Bling Capital, Revolution's Rise of the Rest Seed Fund",Series A,https://www.hermeus.com/press-release-series-a,Platform Systems,2020-10-29,Early Stage Venture,Hermeus,16000000
Govini – Undisclosed,,,Undisclosed,https://www.prnewswire.com/news-releases/defense-tech-unicorn-govini-surpasses-100-million-arr-milestone-302581545.html,,2025-10-13,Miscellaneous,Govini,150000000
Apex Space – Seed,Military Satellites,"Andreessen Horowitz (a16z), J2 Ventures, Lux Capital, Village Global, XYZ Ventures",Seed,https://payloadspace.com/apex-space-emerges-from-stealth-with-a16z-led-7-5m-seed-round/,Space Systems,2022-10-24,Seed,Apex Space,7500000
Shield AI – Series C,Data Analytics & AI,Point72 Ventures,Series C,https://shield.ai/shield-ai-raises-90-million-series-c-funding-point72-ventures-and-other-investors/,Software & IT Services,2021-02-23,Late Stage Venture,Shield AI,90000000
X-Bow – Series A,Missiles & Guided Munitions,"Crosslink, Razor’s Edge, Lockheed Martin Ventures, Broom Ventures",Series A,https://www.prnewswire.com/news-releases/x-bow-systems-leading-3d-printed-solid-rocket-motor-company-raises--27m-series-a-round-301533123.html,Weapon Systems,2022-04-26,Early Stage Venture,X-Bow,27000000
HawkEye 360 – Strategic,Space-based Sensors & ISR,Lockheed Martin Ventures,Strategic,https://www.he360.com/hawkeye-360-closes-additional-10-million-in-series-d-1-funding-from-lockheed-martin-ventures-and-company-insiders/,Space Systems,2023-10-18,Late Stage Venture,HawkEye 360,10000000
Overwatch Imaging – Series A,Radar Systems,"Squadra Ventures, Shield Capital, L3Harris Technologies, Bridger Aerospace, Portland Seed Fund",Series A,https://www.overwatchimaging.com/post/series-a-funding,Electronic Systems,2022-04-05,Early Stage Venture,Overwatch Imaging,11000000
Rune Technologies – Seed,Defense Software,"XYZ Ventures, Point72 Ventures, Andreessen Horowitz (a16z)",Seed,https://www.businesswire.com/news/home/20250226366515/en/Rune-Technologies-Raises-6.2M-in-Seed-Funding-to-Modernize-Military-Logistics,Software & IT Services,2025-02-26,Seed,Rune Technologies,6200000
Zeno Power – Series B,Power & Energy Systems,"Hanaco Ventures, Seraphim Space Investment Trust, Balerion Space Ventures, JAWS, Vanderbilt University, RiverPark Ventures, Stage 1 Ventures, 7i Capital, Beyond Earth Ventures",Series B,https://www.zenopower.com/news/zeno-power-raises-50-million-series-b-to-power-defense-space-and-beyond,Support & Services,2025-05-14,Early Stage Venture,Zeno Power,50000000
Sandtable – Undisclosed,Defense Software,"Silent Venture, Quiet Capital",Undisclosed,https://x.com/SilentVentures/status/1894107786315010444,Software & IT Services,2025-02-24,Seed,Sandtable,0
Shield AI – Series F,Data Analytics & AI,"Riot Ventures, Disruptive, Snowpoint, ARK Invest, U.S. Innovative Technology Fund",Series F,https://shield.ai/shield-ai-raises-additional-capital-in-series-f-boosts-total-amount-to-500m/,Software & IT Services,2023-12-29,Late Stage Venture,Shield AI,300000000
Gecko Robotics – Series A,"Maintenance, Repair, and Overhaul (MRO)","Founders Fund, Mark Cuban, The Westly Group, Y Combinator, Justin Kan",Series A,https://techcrunch.com/2018/08/20/safety-and-inspection-bot-startup-gecko-robotics-adds-7-million-to-the-coffers/,Support & Services,2018-08-20,Early Stage Venture,Gecko Robotics,7000000
HawkEye 360 – Series A,Space-based Sensors & ISR,"Razor’s Edge, Allied Minds",Series A,https://globalventuring.com/university/hawkeye-enters-11m-series-a-orbit/,Space Systems,2016-11-23,Early Stage Venture,HawkEye 360,11000000
Rocket Lab – Series D,Launch Services,"DCVC, Promus Ventures, Bessemer Venture Partners, K1W1 investment fund, Khosla Ventures",Series D,https://www.rocketlabusa.com/updates/series-d-financing/,Space Systems,2017-03-22,Late Stage Venture,Rocket Lab,75000000
Kela – Series A,Defense Software,"Sequoia Capital, Lux Capital",Series A,https://dcahn.substack.com/p/partnering-with-kela-modern-defense?publication_id=2883399&post_id=159257060&isFreemail=true&r=9t47&triedRedirect=true,Software & IT Services,2025-03-17,Early Stage Venture,Kela,29000000
Gallatin – Seed,Logistics & Supply Chain,"8VC, Silent Venture, Moonshots Capital, Timeless Partners, Banter Capital",Seed,https://www.prnewswire.com/news-releases/gallatin-emerges-from-stealth-with-15m-seed-investment-to-transform-defense-logistics-302422537.html,Support & Services,2025-04-08,Seed,Gallatin,15000000
Salient Motion – Seed,Manufacturing Support,"Cantos, Andreessen Horowitz (a16z), AE Ventures, Hummingbird Ventures, Box Group",Seed,https://www.businesswire.com/news/home/20241001351008/en/Salient-Motion-Raises-%2412-Million-to-Scale-Motion-Control-Business,Support & Services,2024-10-01,Seed,Salient Motion,12000000
Proteus Space – Seed,Military Satellites,"Moonshots Capital, Lavrock Ventures, The Veteran Fund, Mana Ventures, AIN Ventures, Capital Factory, Industrious Ventures",Seed,https://www.einpresswire.com/article/660702526/proteus-space-raises-4-2-million-and-opens-rapid-satellite-facility-in-la,Space Systems,2023-10-10,Seed,Proteus Space,4200000
HawkEye 360 – Series B,Space-based Sensors & ISR,"Airbus, Esri, Razor’s Edge, Allied Minds, Shield Capital",Series B,https://www.he360.com/hawkeye-360-secures-70-million-in-series-b-financing/,Space Systems,2019-08-06,Early Stage Venture,HawkEye 360,70000000
Electra – Series B,Military Aircraft,"Prysm Capital, Lockheed Martin Ventures, Honeywell, Safran, Statkraft Ventures, Virginia Innovation Partnership Corporation",Series B,https://www.electra.aero/news/electra-raises-115-million,Platform Systems,2025-04-21,Early Stage Venture,Electra,115000000
SWARM Biotactics – Seed,,"Vertex Ventures, Possible Ventures, Capnamic",Seed,https://www.swarm-biotactics.com/pressreleases/euro-13m-raised-swarm-biotactics-advances-bio-robotics-from-lab-to-field/,,2025-06-24,Seed,SWARM Biotactics,11600000
X-Bow – Series B,Missiles & Guided Munitions,"Razor’s Edge, Boeing Ventures, Lockheed Martin Ventures, Crosslink, Balerion Space Ventures",Series B,https://www.prnewswire.com/news-releases/x-bow-raises-more-than-70-million-series-b-to-accelerate-expansion-of-hypersonic-and-solid-rocket-motor-technologies-302193599.html,Weapon Systems,2024-07-10,Early Stage Venture,X-Bow,70000000
True Anomaly – Series A,Military Satellites,"Eclipse, Riot Ventures, Champion Hill Ventures, Space VC, Narya",Series A,https://www.prnewswire.com/news-releases/true-anomaly-emerges-from-stealth-to-revolutionize-space-security-stability-and-sustainability-301791297.html,Space Systems,2023-04-06,Early Stage Venture,True Anomaly,17000000
Dirac – Undisclosed,Manufacturing Support,"Founders Fund, Coatue",Undisclosed,https://www.businessinsider.com/siemens-dirac-partnership-ai-machinery-assembly-coatue-funding-2025-8,Support & Services,2025-08-21,Miscellaneous,Dirac,10700000
Chaos – Series C,Radar Systems,"New Enterprise Associates, Accel, StepStone Group, Overmatch Ventures, Tru Arrow, Valor Equity",Series C,https://www.businesswire.com/news/home/20250502192148/en/CHAOS-Industries-Raises-%24275-Million-Series-C-to-Advance-Defense-and-National-Security-Technology-Innovation,Electronic Systems,2025-05-02,Late Stage Venture,Chaos,275000000
Merlin Labs – Series A,Military Aircraft,"Google Ventures, First Round Capital",Series A,https://www.prnewswire.com/news-releases/merlin-labs-announces-25m-funding-round-and-partnership-to-bring-autonomy-to-55-aircraft-fleet-301300079.html,Platform Systems,2021-05-26,Early Stage Venture,Merlin Labs,25000000
Onebrief – Series B,Defense Software,"Human Capital, 9Yards Capital, Caffeinated Capital",Series B,https://www.onebrief.com/content-hub/onebrief-secures-53m-to-build-the-future-of-military-staffs,Software & IT Services,2024-12-11,Early Stage Venture,Onebrief,53000000
Adyton – Undisclosed,Defense Software,"Venrock, Khosla Ventures, Liquid 2 Ventures, Alumni Ventures, Initialized Capital, Kindred Ventures, Leblon Capital",Undisclosed,https://www.tectonicdefense.com/exclusive-adyton-raises-11m-scores-a-7m-navy-contract/,Software & IT Services,2025-05-15,Early Stage Venture,Adyton,11000000
Elroy Air – Series A,Unmanned Aerial Vehicles (UAVs),"Lockheed Martin Ventures, Marlinspike Capital, Prosperity7 Ventures, Catapult Ventures, DiamondStream Partners, Side X Side Management, Precursor Ventures, Shield Capital",Series A,https://elroyair.com/company/news/press-releases/elroy-series-a-financing/,Platform Systems,2021-08-03,Early Stage Venture,Elroy Air,40000000
Reality Defender – Series A,Cybersecurity Solutions,"DCVC, Comcast, Partnership Fund for New York City, Rackhouse Venture Capital, AI Grant, Y Combinator",Series A,https://www.prnewswire.com/news-releases/deepfake-detection-platform-reality-defender-secures-15-million-in-series-a-funding-led-by-dcvc-301958923.html,Software & IT Services,2023-10-17,Early Stage Venture,Reality Defender,15000000
Xona – Series B,Military Satellites,"Craft Ventures, Stellar Ventures, Seraphim Ventures, Toyota Ventures, First Spark, Industrious Ventures, Future Ventures, NGP Capital",Series B,https://www.xonaspace.com/news/series-b,Space Systems,2025-06-26,Early Stage Venture,Xona,72000000
Firefly – Series B,Launch Services,AE Industrial Partners,Series B,https://fireflyspace.com/news/ae-industrial-partners-leads-75-million-series-b-growth-equity-investment-in-firefly-aerospace-a-leading-provider-of-launch-and-in-space-vehicles/,Space Systems,2022-04-19,Early Stage Venture,Firefly,75000000
ReOrbit – Series A,,"Springvest, Varma, Development Bank of Japan, Icebreaker, Expansion VC, 10X Founders, Inventure VC",Series A,https://www.reorbit.space/resources/articles/reorbit-secures-eur45-million-to-manufacture-sovereign-satellites-and-connected-systems-for-national-security,,2025-09-09,Early Stage Venture,ReOrbit,52704000
Laborup – Seed,,"NVP, Torch Capital, Threshold, Heartland VC, Daybreak, Westbound, Jeff Jordan, Marketplace Capital, Market Square Ventures",Seed,https://www.laborup.com/post/laborup-raises-7-7m-to-power-americas-industrial-workforce,,2025-08-28,Seed,Laborup,7700000
Astro Mechanica – Undisclosed,Military Aircraft,"Andreessen Horowitz (a16z), Lowercarbon, Giant Step Capital, Alumni Ventures, Voyager Capital, Dolby Family Ventures, Eli Dourado, Julian Capital, Industrious Ventures, Myelin VC, Not Boring, Wayfinder, Y Combinator, Astera Institute",Undisclosed,https://www.tectonicdefense.com/exclusive-astro-mechanica-raises-27-1m-for-supersonic-flight/,Platform Systems,2025-04-17,Miscellaneous,Astro Mechanica,27100000
Bounce Imaging – Series A,Radar Systems,"R42 Group, Good Growth Capital, Tanis Ventures, Helen Greiner, Ed Roberts, Backstage Capital",Series A,https://bounceimaging.com/2022-5-2-bounce-imaging-raises-4-2-million-series-a-prime-round-adds-former-pentagon-chief-to-board/,Electronic Systems,2022-05-02,Early Stage Venture,Bounce Imaging,4200000
Beacon AI – Series A,Defense Software,"Costanoa Ventures, Scout Ventures, Sam Altman, JetBlue Ventures",Series A,https://www.prnewswire.com/news-releases/beacon-ai-secures-15m-in-series-a-funding-to-bring-ai-into-flight-decks-302275720.html,Software & IT Services,2024-10-15,Early Stage Venture,Beacon AI,15000000
Anduril Industries – Seed,,"General Catalyst, Founders Fund, 8VC",Seed,https://web.archive.org/web/20210414015255/https://www.wired.com/story/palmer-luckey-anduril-border-wall/,Software & IT Services,2017-06-01,Seed,Anduril Industries,17500000
Ursa Major – Series C,Missiles & Guided Munitions,"XN, Alsop Louie Partners, Explorer 1, Dolby Family Ventures, Alpha Edison, Space Capital, Harpoon Ventures",Series C,https://www.ursamajor.com/media/press-release/ursa-major-raises-usd85-million-in-series-c-funding,Weapon Systems,2021-12-07,Late Stage Venture,Ursa Major,85000000
Dedrone – Series C,Electronic Warfare Systems,"Axon, Aqton Partners, Menlo Ventures, Target Partners, TempoCap, John Chambers, Felicis",Series C,https://www.dedrone.com/press/dedrone-secures-30-5-million-series-c-to-protect-airspace-against-unauthorized-drones,Electronic Systems,2021-12-17,Late Stage Venture,Dedrone,30500000
Forterra – Series B,Unmanned Ground Vehicles (UGVs),"Moore Strategic Ventures, XYZ Ventures, Hedosophia, Standard Investments, Enlightenment Capital, Crescent Cove Advisors, Four More Capital",Series B,https://www.forterra.com/posts/forterra-raises-75-million-series-b,Platform Systems,2024-09-10,Early Stage Venture,Forterra,75000000
Applied Intuition – Series C,Defense Software,"Lux Capital, Andreessen Horowitz (a16z), General Catalyst, Bilal Zuberi",Series C,https://www.prnewswire.com/news-releases/applied-intuition-raises-125m-series-c-from-existing-investors-lux-capital-andreessen-horowitz-and-general-catalyst-301159996.html,Software & IT Services,2020-10-27,Late Stage Venture,Applied Intuition,125000000
Mach Industries – Series B,Unmanned Aerial Vehicles (UAVs),"Khosla Ventures, Bedrock, Sequoia Capital",Series B,https://www.prnewswire.com/news-releases/mach-industries-raises-100-million-in-series-b-funding-to-advance-us-defense-manufacturing-302483147.html,Platform Systems,2025-06-17,Early Stage Venture,Mach Industries,100000000
Senra Systems – Series A,,"Dylan Field, CIV, General Catalyst, Sequoia Capital, Founders Fund, Andreessen Horowitz (a16z), 8VC, Pax Ventures",Series A,https://www.senrasystems.us/media/announcing-our-series-a,,2025-06-18,Early Stage Venture,Senra Systems,25000000
Ethos – Series A,,"The Westly Group, Norwest Venture Partners, Pear VC",Series A,https://www.prnewswire.com/news-releases/enterprise-saas-training-platform-learn-to-win-closes-30-million-series-a-funding-round-302169853.html,,2024-06-12,Early Stage Venture,Ethos,30000000
Divergent Technologies – Series B,Manufacturing Support,"Shanghai Alliance , Altran Technologies",Series B,https://www.businesswire.com/news/home/20171121006158/en/Divergent-3D-Announces-Series-B-and-Related-Funding,Support & Services,2017-11-21,Early Stage Venture,Divergent Technologies,65000000
Firehawk Aerospace – Series C,Missiles & Guided Munitions,"1789 Capital, Draper Associates, BOKA Group",Series C,https://www.forbes.com/sites/davidjeans/2025/01/06/trump-jr-1789-capital-firehawk/,Weapon Systems,2025-01-06,Late Stage Venture,Firehawk Aerospace,60000000
Interlune – Seed,Logistics & Supply Chain,"Seven Seven Six, Aurelia Foundry, Gaingels, Liquid2 Ventures, Shasta Ventures",Seed,https://www.interlune.space/press-release/space-resources-startup-interlune-raises-18-million-in-seed-capital,Support & Services,2024-03-13,Seed,Interlune,18000000
Swarmbotics AI – Undisclosed,Unmanned Ground Vehicles (UGVs),"Quiet Capital, Silent Venture, LMNT Ventures, Soma Capital",Undisclosed,https://techcrunch.com/2024/08/19/swarmbiotics-founders-grew-obsessed-with-robot-swarms-and-now-plan-to-bring-them-to-the-battlefield/,Platform Systems,2024-08-19,Seed,Swarmbotics AI,4000000
World View – Series D,Space-based Sensors & ISR,SNC,Series D,https://www.businesswire.com/news/home/20240227589814/en/World-View-Secures-Strategic-Series-D-Funding-Led-by-SNC,Space Systems,2024-02-27,Late Stage Venture,World View,0
Apex Space – Series A,Military Satellites,"Andreessen Horowitz (a16z), Shield Capital",Series A,https://www.businesswire.com/news/home/20230622417907/en/Apex-Raises-16M-in-Series-A-Funding-and-Reveals-Customers-Flying-on-its-First-Aries-Satellite-Bus,Space Systems,2023-06-22,Early Stage Venture,Apex Space,16000000
True Anomaly – Series C,Military Satellites,"Accel, Meritech Capital, Eclipse, Riot Ventures, Menlo Ventures, 645 Ventures, ACME Capital, Space VC, Champion Hill Ventures, Narya",Series C,https://www.trueanomaly.space/newsroom/announcing-our-260m-fundraise,Space Systems,2025-04-30,Late Stage Venture,True Anomaly,260000000
Hermeus – Series B,Military Aircraft,"Sam Altman, Founders Fund, In-Q-Tel, Khosla Ventures, Canaan Partners, Bling Capital, Revolution's Rise of the Rest Seed Fund",Series B,https://www.hermeus.com/press-release-series-b,Platform Systems,2022-03-10,Early Stage Venture,Hermeus,100000000
Solestial – Seed,Power & Energy Systems,"Airbus, AEI HorizonX, GPVC, Stellar Ventures, Industrious Ventures",Seed,https://www.businesswire.com/news/home/20221011005573/en/Airbus-Ventures-Leads-Solestial%E2%80%99s-Oversubscribed-10M-Seed-Round,Support & Services,2022-10-11,Seed,Solestial,10000000
