Amount,Company,Announcement ,Stage,Type (Stage),Date,Investors,Sector,Fundraising Round,Category
70000000,Chaos,https://news.crunchbase.com/venture/chaos-industries-defense-tech-anduril/,Early Stage Venture,Series A,2023-03-06,"8VC, Alpha Wave Global, Lerner Enterprises, Tamarack Global, Valar Ventures, Liquid2 Ventures",Radar Systems,Chaos – Series A,Electronic Systems
75000000,Firefly,https://fireflyspace.com/news/firefly-completes-oversubscribed-75m-series-a-and-100m-secondary-transaction/,Early Stage Venture,Series A,2021-05-05,"DADA Holdings, Astera Institute, Canon Ball, Reuben Brothers Limited, SMS Capital Investment, Raven One Ventures, XBTO Ventures",Launch Services,Firefly – Series A,Space Systems
100000000,Saildrone,https://www.saildrone.com/news/saildrone-advance-ocean-intelligence-series-c-funding,Late Stage Venture,Series C,2021-10-18,"Standard Investments, XN, BOND, Emerson Collective, Crowley Maritime Corporation, Lux Capital, Social Capital, Tribe Capital, Capricorn",Maritime Systems,Saildrone – Series C,Platform Systems
14000000,Saildrone,https://www.prnewswire.com/news-releases/saildrone-inc-raises-14-million-in-series-a-funding-to-expand-its-fleet-of-sailing-drones-and-ocean-data-services-300322444.html,Early Stage Venture,Series A,2016-09-05,,Maritime Systems,Saildrone – Series A,Platform Systems
110000000,K2 Space,https://www.prnewswire.com/news-releases/k2-space-announces-110m-series-b-and-first-successful-in-space-demonstration-302375955.html,Early Stage Venture,Series B,2025-02-13,"Lightspeed Venture Partners, Alpine Space Ventures, Altimeter Capital, First Round Capital",Military Satellites,K2 Space – Series B,Space Systems
23000000,Andesite,https://www.globenewswire.com/news-release/2025/02/11/3024316/0/en/Andesite-Raises-Additional-23-Million-and-Announces-General-Availability-of-the-Bionic-SOC.html,Seed,Seed,2025-02-11,"General Catalyst, Red Cell Partners",Cybersecurity Solutions,Andesite – Seed,Software & IT Services
21000000,Darkhive,https://www.darkhive.com/post/defense-tech-startup-darkhive-secures-21-million-series-a-investment-led-by-ten-eleven-ventures,Early Stage Venture,Series A,2024-09-09,"Ten Eleven Ventures, Crosslink, RTX Ventures, Stellar Ventures",Unmanned Aerial Vehicles (UAVs),Darkhive – Series A,Platform Systems
12900000,ARX Robotics,https://tech.eu/2025/07/29/arx-robotics-secures-eur11m-in-series-a-extension/,Early Stage Venture,Extension,2025-07-29,"Speedinvest, HV Capital",Unmanned Ground Vehicles (UGVs),ARX Robotics – Extension,Platform Systems
18000000,REGENT,https://www.regentcraft.com/news/regent-raises-18m-from-strategic-investors-to-accelerate-development-of-its-full-scale-12-passenger-prototype,Miscellaneous,Strategic,2022-02-04,"Thiel Capital, JAM Fund, Mesa Air Group, Toba Capital, Olive Tree Capital",Maritime Systems,REGENT – Strategic,Platform Systems
65000000,CesiumAstro,https://www.cesiumastro.com/press-release/cesiumastro-secures-65m-in-oversubscribed-funding-round,Early Stage Venture,Extension,2024-06-18,"Trousdale Ventures, Development Bank of Japan, Quanta Computer, Kleiner Perkins, Lavrock Ventures, L3Harris Technologies, InMotion Ventures, Matter Venture Partners, MESH Ventures, Assembly Ventures",Communication Equipment,CesiumAstro – Extension,Electronic Systems
120000000,Re:Build,https://rebuildmanufacturing.com/news/general-catalyst-invests-in-rebuild-manufacturing/,Miscellaneous,Undisclosed,2024-09-25,General Catalyst,Manufacturing Support,Re:Build – Undisclosed,Support & Services
14300000,SEMPRE,https://www.sempre.ai/news/sempre-closes-14-3m-series-a-with-additional-support-from-existing-investors-and-new-2m-investment-from-pendrell,Early Stage Venture,Series A,2025-05-08,"Pendrell, 90 Degree North",Communication Equipment,SEMPRE – Series A,Electronic Systems
15000000,Saronic,https://silentventures.medium.com/silent-ventures-backed-saronic-raises-55m-series-a-will-redefine-u-s-maritime-superiority-48fbf26f687b,Seed,Seed,2023-01-01,"Silent Venture, Caffeinated Capital, 8VC, Andreessen Horowitz (a16z), Lightspeed Venture Partners, Point72 Ventures, U.S. Innovative Technology Fund, Cubit Capital",Maritime Systems,Saronic – Seed,Platform Systems
9500000,Hadrian,https://techcrunch.com/2021/04/15/hadrian-is-building-the-factories-of-the-future-for-rocket-ships-and-advanced-manufacturing/,Seed,Seed,2021-04-01,"Lux Capital, Founders Fund, Construct Capital",Manufacturing Support,Hadrian – Seed,Support & Services
10100000,Deterrence,https://www.prweb.com/releases/deterrence-secures-10-1m-in-funding-to-automate-energetics-production-302329902.html,Seed,Seed,2024-12-12,"Riot Ventures, Definition Capital, Impatient Ventures, Valhalla Ventures, Banter Capital, Dmitri Alperovitch",Ammunition & Explosives,Deterrence – Seed,Weapon Systems
40000000,Applied Intuition,https://www.appliedintuition.com/news/series-b-announcement,Early Stage Venture,Series B,2019-09-12,"General Catalyst, Kleiner Perkins, Andreessen Horowitz (a16z), Lux Capital, Floodgate, M12, Sozo Ventures, La Famiglia",Defense Software,Applied Intuition – Series B,Software & IT Services
10000000,Impulse Space,https://www.impulsespace.com/updates/impulse-space-secures-dollar10m-from-lux-capital-rounding-out-recent-funding-to-dollar30m,Miscellaneous,Strategic,2022-06-16,Lux Capital,Launch Services,Impulse Space – Strategic,Space Systems
20000000,Zeno Power,https://www.pallasadvisors.com/post/pallas-ventures-invests-in-zeno-power-series-a,Early Stage Venture,Series A,2022-04-28,"Tribe Capital, Pallas Ventures, DCVC, AIN Ventures, 1517",Power & Energy Systems,Zeno Power – Series A,Support & Services
111320000,Quantum Systems,https://quantum-systems.com/blog/2024/09/24/quantum-systems-increases-series-b-financing-volume/,Early Stage Venture,Series B,2024-09-24,"Notion, Porsche SE, Peter Thiel, HV Capital, DTCP, Project A, Thiel Capital, ScaleUp Fonds Bayern, Omnes Capital, Airbus",,Quantum Systems – Series B,
10000000,Auterion,https://venturebeat.com/entrepreneur/auterion-raises-10-million-for-open-source-drone-operating-system/,Miscellaneous,Undisclosed,2018-11-04,"Lakestar, Mosaic Ventures, Costanoa Ventures, Tectonic Ventures",Defense Software,Auterion – Undisclosed,Software & IT Services
1900000,ACUA Ocean,https://www.oceansciencetechnology.com/news/acua-ocean-receives-backing-to-develop-hydrogen-powered-usv/,Seed,Pre-Seed,2024-12-11,"StealthPoint, BritBots, Sixth Wave Ventures, Blue Action Accelerator",Maritime Systems,ACUA Ocean – Pre-Seed,Platform Systems
30000000,Dedrone,https://www.dedrone.com/press/dedrone-closes-30-million-series-c-1-financing,Late Stage Venture,Extension,2022-07-13,"Axon, Aqton Partners, Menlo Ventures, TargetPartners, Felicis",Electronic Warfare Systems,Dedrone – Extension,Electronic Systems
7500000,Foundation Alloy,https://www.foundationalloy.com/press-release-raise-with-aff,Early Stage Venture,Undisclosed,2025-05-07,"Alumni Ventures, America's Frontier Fund, Engine Ventures, Intel Capital, Material Impact, Yamaha Motor Ventures",Advanced Materials,Foundation Alloy – Undisclosed,Support & Services
70000000,Second Front Systems,https://www.secondfront.com/resources/blog/series-c-ceo-announcement/,Late Stage Venture,Series C,2024-09-16,"Battery Ventures, Salesforce Ventures, NEA, Moore Strategic Ventures, Artis Venture",Defense Software,Second Front Systems – Series C,Software & IT Services
40000000,Gecko Robotics,https://www.prnewswire.com/news-releases/y-combinator-alum-gecko-robotics-raises-40-million-series-b-round-led-by-drive-capital-supporting-rapid-growth-in-industrial-inspection-robotics-300975388.html,Early Stage Venture,Series B,2019-12-16,"Drive Capital, Founders Fund, Next47, Y Combinator, Mark Cuban, Josh Reeves, Jake Seid, Justin Kan, Gokul Rajaram, Paul Buchheit","Maintenance, Repair, and Overhaul (MRO)",Gecko Robotics – Series B,Support & Services
138000000,Ursa Major,https://www.ursamajor.com/media/press-release/ursa-majors-dollar138m-boost-new-solid-rocket-motors-and-scaled-propulsion,Late Stage Venture,Series D,2023-11-30,"Explorer 1, Eclipse, RTX Ventures",Missiles & Guided Munitions,Ursa Major – Series D,Weapon Systems
30000000,Antares,https://antaresindustries.com/updates/antares-secures-30-million-series-a-to-accelerate-defense-space-and-industrial-focused-nuclear-energy,Early Stage Venture,Series A,2024-10-30,"AltCap, Caffeinated Capital, Rogue VC, Uncommon Captial, Shrug Capital, Banter Capital, Box Group, Shine Capital",Power & Energy Systems,Antares – Series A,Support & Services
40000000,Radiant,https://radiantnuclear.com/blog/series-b/,Early Stage Venture,Series B,2023-04-24,"Andreessen Horowitz (a16z), Founders Fund, Decisive Point, Cantos, Draper Associates, Boost VC, McKinley Alaska",,Radiant – Series B,
10500000,Foundation Alloy,https://www.forbes.com/sites/ariyanagriffin/2022/05/31/this-startup-raised-over-10-million-to-make-metal-manufacturing-more-efficient-and-sustainable/,Seed,Seed,2022-05-31,"The Engine and Material Impact, Safar Partners",Advanced Materials,Foundation Alloy – Seed,Support & Services
0,TEKEVER,https://www.tekever.com/news/tekever-confirmed-as-europes-newest-unicorn-as-it-invests-400m-in-the-uk-to-drive-ai-driven-defence/,Miscellaneous,Undisclosed,2025-05-06,"Ventura Capital, Baillie Gifford, NATO Innovations Fund, Iberis Capital, Crescent Cove Advisors",Unmanned Aerial Vehicles (UAVs),TEKEVER – Undisclosed,Platform Systems
6100000,Proteus Space,https://spacenews.com/proteus-achieves-breakthrough-in-automated-high-fidelity-structural-design-signs-first-commercial-payload-customer-and-secures-oversubscribed-6-1m-seed-2-funding/,Seed,Seed,2025-03-18,"Lavrock Ventures, The Veteran Fund, SAIC, Crosscut Ventures, Moonshots Capital",Military Satellites,Proteus Space – Seed,Space Systems
3000000,Skydio,https://cdixon.org/2015/01/15/skydio,Seed,Seed,2015-01-15,Andreessen Horowitz (a16z),Unmanned Aerial Vehicles (UAVs),Skydio – Seed,Platform Systems
0,Sphinx,https://www.block3.us/news-post,Miscellaneous,Strategic,2024-11-18,Block 3,Cybersecurity Solutions,Sphinx – Strategic,Software & IT Services
30000000,Urban Sky,https://www.urbansky.com/post/urban-sky-raises-30-million-in-series-b-funding-to-unlock-routine-and-easy-global-access-to-the-str,Early Stage Venture,Series B,2025-02-06,"Altos Ventures, New Legacy Ventures, Lerer Hippeau, Catapult Ventures, Lavrock Ventures, New Stack Ventures, TenOneTen, DA Ventures, Union Labs VC, Techstars Ventures",Military Satellites,Urban Sky – Series B,Space Systems
6000000,Overwatch Imaging,https://www.overwatchimaging.com/post/overwatch-imaging-secures-6m-in-venture-funding,Miscellaneous,Undisclosed,2025-07-15,"Squadra Ventures, SEMCAP AI, Elevate Oregon Venture Direct Fund, Edo Capital",Radar Systems,Overwatch Imaging – Undisclosed,Electronic Systems
19000000,Capella Space,https://www.capellaspace.com/press-releases/capella-space-closes-19m-series-b-to-deliver-reliable-earth-observation-data-on-demand,Early Stage Venture,Series B,2018-09-26,"Spark Capital, DCVC, Mark VC, Harmony Partners",Space-based Sensors & ISR,Capella Space – Series B,Space Systems
5000000,Solideon,https://www.accessnewswire.com/newsroom/en/industrial-and-manufacturing/solideon-oversubscribes-pre-seed-goals-advances-vision-for-future-manuf-889960,Seed,Pre-Seed,2024-07-17,"8090 Industries, 1517, Stellar Ventures, Boost VC, 10X Founders, Pathbreaker Ventures, AIN Ventures, Tiny VC, MD One Ventures, Reinforced Ventures, Techstars Space, Capital Factory, Vibe Capital, Gaingels",Manufacturing Support,Solideon – Pre-Seed,Support & Services
30000000,Spinlaunch,https://www.businesswire.com/news/home/20250818553463/en/SpinLaunch-Announces-Closing-of-%2430M-in-Funding-to-Accelerate-the-Development-of-the-Meridian-Space-Constellation,Late Stage Venture,Undisclosed,2025-08-18,"ATW Partners, Kongsberg Defence & Aerospace",Launch Services,Spinlaunch – Undisclosed,Space Systems
7100000,Obviant,https://www.obviant.com/blog/obviant-raises-7-1m-in-funding-to-scale-its-data-intelligence-platform-for-defense-acquisition-contracting-and-budgeting,Seed,Undisclosed,2025-06-24,"Shield Capital, Motivate Venture Capital, A*, New Vista Capital, Aloft VC, Underdog Labs",,Obviant – Undisclosed,Support & Services
24000000,Rune Technologies,https://www.businesswire.com/news/home/20250721838717/en/Rune-Technologies-Closes-%2424M-Series-A-to-Deploy-AI-Enabled-Software-for-Military-Logistics,Early Stage Venture,Series A,2025-07-22,"Human Capital, Pax Ventures, Washington Harbour Partners, Andreessen Horowitz (a16z), Point72 Ventures, XYZ Ventures, Forward Deployed VC",Defense Software,Rune Technologies – Series A,Software & IT Services
3300000,Usul,https://www.tectonicdefense.com/exclusive-usul-raises-3-3m-to-help-companies-win-defense-contracts/,Seed,Seed,2025-05-12,"Scout Ventures, Bravo Victor Venture Capital, Y Combinator, Steve Blank, Peter Newell, Jack Shanahan, Jacqueline Tame",Consulting & Engineering Services,Usul – Seed,Support & Services
131000000,Armada,https://www.prnewswire.com/news-releases/armada-announces-131m-strategic-funding-round-launch-of-megawatt-scale-modular-ai-data-centers-to-accelerate-american-energy-and-ai-dominance-302513137.html,Miscellaneous,Strategic,2025-07-24,"Pinegrove, Veriten, Glade Brook, Founders Fund, Lux Capital, Shield Capital, 8090 Industries, M12, Overmatch Ventures, Silent Venture, Felicis, Marlinspike",Data Analytics & AI,Armada – Strategic,Software & IT Services
2500000000,Anduril Industries,https://www.bloomberg.com/news/articles/2025-06-05/defense-startup-anduril-cllinches-funding-at-30-5-billion-valuation,Late Stage Venture,Series G,2025-06-05,Founders Fund,,Anduril Industries – Series G,Software & IT Services
17800000,Fortem Technologies,https://www.prnewswire.com/news-releases/fortem-technologies-closes-17-8m-in-funding-round-to-scale-airspace-safety-and-security-capabilities-301752008.html,Miscellaneous,Undisclosed,2023-02-21,"Lockheed Martin Ventures, Hanwha Aerospace, Crumpton Ventures, DCVC, Signia Venture Partners",Electronic Warfare Systems,Fortem Technologies – Undisclosed,Electronic Systems
5700000,Mach Industries,https://www.reuters.com/technology/sequoia-makes-first-defense-tech-investment-mach-industries-2023-06-15/,Seed,Seed,2023-06-16,Sequoia Capital,Unmanned Aerial Vehicles (UAVs),Mach Industries – Seed,Platform Systems
10000000,Fortem Technologies,https://fortemtech.com/press-releases/2024-11-13-lago-innovation-fund-facilitates-10mm-investment-in-fortem-technologies-to-support-demand-for-drone-defense-solutions/,Miscellaneous,Strategic,2024-11-13,LAGO Innovation Fund,Electronic Warfare Systems,Fortem Technologies – Strategic,Electronic Systems
5000000,HawkEye 360,https://www.he360.com/hawkeye-360-adds-leidos-as-investor-to-bring-series-d-round-to-150-million/,Late Stage Venture,Strategic,2022-01-06,Leidos,Space-based Sensors & ISR,HawkEye 360 – Strategic,Space Systems
140000000,Rocket Lab,https://www.rocketlabusa.com/updates/rocket-lab-announces-140-million-in-new-funding/,,Series E,2018-11-15,"Future Fund, Greenspring Associates, Khosla Ventures, Bessemer Venture Partners, Promus Ventures, K1W1 investment fund, ACC",Launch Services,Rocket Lab – Series E,Space Systems
150000000,Impulse Space,https://www.impulsespace.com/updates/impulse-space-secures-dollar150m-in-series-b-funding-to-support-ongoing-company-momentum,Early Stage Venture,Series B,2024-10-01,"Founders Fund, Lux Capital, Spring Tide, DCVC, Airbus, Alumni Ventures, Balerion Space Ventures, RTX Ventures, Tamarack Global, 137 Ventures, Elysium, First Principles Group, Island Green, Overmatch Ventures, Trousdale Ventures",Launch Services,Impulse Space – Series B,Space Systems
13000000,Vatn Systems,https://www.prnewswire.com/news-releases/vatn-systems-raises-13-million-seed-round-to-advance-autonomous-underwater-vehicles-for-us-defense-302301937.html,Seed,Seed,2024-11-12,"DYNE Ventures, Lockheed Martin Ventures, RTX Ventures, In-Q-Tel, Propeller Ventures, SAIC, Cubit Capital, Fortitude Ventures, Centre Street Partners, The Veteran Fund, Blue Collective, Decisive Point",Maritime Systems,Vatn Systems – Seed,Platform Systems
83000000,Shift5,https://www.axios.com/2023/06/07/defense-contractor-shift5-closes-83m-series-b-round,Early Stage Venture,Series B,2023-06-07,"Moore Strategic Ventures, Booz Allen Ventures",Cybersecurity Solutions,Shift5 – Series B,Software & IT Services
10000000,Andrenam,https://www.andrenam.com/andrenam-raises-10m,Seed,Seed,2025-06-16,"First Round Capital, Also Capital, Long Journey, 201, Banter Capital, Homebrew, Wavefunction, Colorado School of Mines Venture Fund",,Andrenam – Seed,
4000000,PiLogic,https://spacenews.com/pilogic-raises-4-million-for-bespoke-satellite-ai-models/,Seed,Seed,2025-05-22,"Scout Ventures, Seraphim Space Investment Trust, Sovereign's Capital, Flex Capital, FN Fund, Gokul Rajaram",,PiLogic – Seed,
25000000,Nooks,https://nooks.works/25M-Series-A/,Early Stage Venture,Series A,2025-06-09,"Zigg Capital, Upper90, SAIC, Lockheed Martin Ventures",,Nooks – Series A,
250000000,Epirus,https://www.epirusinc.com/press-releases/epirus-closes-250m-series-d-to-hyperscale-leonidas-production-capability-for-critical-asset-protection,Late Stage Venture,Series D,2025-03-05,"8VC, Washington Harbour Partners, Oppenheimer, NightDragon, Manhattan Venture Partners, Centaurus Capital LP, Center15 Capital, General Dynamics Land Systems, StepStone Group, Gaingels",Electronic Warfare Systems,Epirus – Series D,Electronic Systems
487000000,Helsing,https://helsing.ai/newsroom/helsing-further-strengthens-european-defence-capabilities-with-funding-round,Late Stage Venture,Series C,2024-07-10,"General Catalyst, Elad Gil, Accel, Saab, Lightspeed Venture Partners, Plural, Greenoaks",Data Analytics & AI,Helsing – Series C,Software & IT Services
0,Gastops,https://www.gastops.com/news-resources/gastops-receives-investment-from-rtx-for-next-generation-monitoring-technologies/,Miscellaneous,Undisclosed,2025-05-28,RTX Ventures,,Gastops – Undisclosed,
3100000,Esper Satellite Imagery,https://payloadspace.com/esper-satellites-raises-3-1m-seed-round/,Seed,Seed,2025-03-04,"Paspalis Capital, Hejaz",Space-based Sensors & ISR,Esper Satellite Imagery – Seed,Space Systems
173000000,Gecko Robotics,https://www.geckorobotics.com/news/gecko-robotics-raises-usd100-million-to-extend-its-series-c-funding-enabling,Late Stage Venture,Series C,2023-12-05,"U.S. Innovative Technology Fund, Founders Fund, XN, XYZ Ventures, Drive Capital, Snowpoint, Joe Lonsdale, Mark Cuban, Gokul Rajaram","Maintenance, Repair, and Overhaul (MRO)",Gecko Robotics – Series C,Support & Services
600000000,Saronic,https://www.prnewswire.com/news-releases/saronic-raises-600m-series-c-to-take-on-autonomous-shipbuilding-302379441.html,Late Stage Venture,Series C,2025-02-18,"Elad Gil, General Catalyst, Andreessen Horowitz (a16z), 8VC, Caffeinated Capital",Maritime Systems,Saronic – Series C,Platform Systems
8800000,Orbital Operations,https://payloadspace.com/orbital-operations-raises-8-8m-for-high-thrust-orbital-vehicle/,Seed,Seed,2025-08-07,"Initialized Capital, Harpoon Ventures, DTX Ventures, Rebel Fund, TRAC VC, Karman Ventures, Immad Akhund",Launch Services,Orbital Operations – Seed,Space Systems
170000000,Skydio,https://www.skydio.com/blog/autonomous-drone-skydio-announces-170-million-series-d-funding,Late Stage Venture,Series D,2021-03-01,"Andreessen Horowitz (a16z), Linse Capital, IVP, Next47, UP.Partners",Unmanned Aerial Vehicles (UAVs),Skydio – Series D,Platform Systems
8100000,Second Front Systems,https://www.secondfront.com/resources/news/seed-round-2021/,Seed,Seed,2021-01-27,"8VC, Artis Venture, Abstract Ventures, Kleiner Perkins, Gula Tech Adventures, Pallas Ventures",Defense Software,Second Front Systems – Seed,Software & IT Services
5000000,Schemata,https://www.linkedin.com/posts/jamesbrn_funding-announcement-excited-to-announce-activity-7330249780444413953-4SLS?utm_source=share&utm_medium=member_desktop&rcm=ACoAAAk_HOUBVRuNQld075fZp5ULmiAqfOZvVhM,Seed,Seed,2025-05-14,"Owl Ventures, Anorak Ventures, Andreessen Horowitz (a16z), Alumni Ventures, Time Zero Capital",,Schemata – Seed,
0,EpiSci,https://www.episci.com/newsroom/z70zktrf3b7d8g38o3cwosorx12fq1,Seed,Pre-Seed,2023-04-20,"Decisive Point, Lockheed Martin Ventures, RTX Ventures, Top Aces",Data Analytics & AI,EpiSci – Pre-Seed,Software & IT Services
200000000,Epirus,https://www.epirusinc.com/press-releases/epirus-raises-200-million-in-series-c-funding,Late Stage Venture,Series C,2022-02-15,"T. Rowe Price Associates, Inc., 8VC, Bedrock, Broom Ventures, EPIQ Capital Group, General Dynamics Land Systems, Gaingels, I Squared Capital, Moore Strategic Ventures, Parkwood, Piedmont Capital Investments, Red Cell Partners, StepStone Group",Electronic Warfare Systems,Epirus – Series C,Electronic Systems
3400000,Durin,https://techcrunch.com/2025/04/23/durin-digs-up-3-4m-to-automate-drills-for-critical-minerals-exploration/,Seed,Pre-Seed,2025-04-23,"8090 Industries, Andreessen Horowitz (a16z), 1517, Bedrock, Champion Hill Ventures, Contrary, Day One Ventures, Lux Capital",Manufacturing Support,Durin – Pre-Seed,Support & Services
19000000,Cambium,https://www.cambium-usa.com/wp-content/uploads/2023/12/Cambium-Series-A-announcement.pdf,Early Stage Venture,Series A,2023-12-05,"Veteran Ventures, 8VC, GSBackers, Marlinspike, MVP Ventures, Gaingels, Kern Venture Fund, Jackson Moses, Vertical Capital",Advanced Materials,Cambium – Series A,Support & Services
10000000,Galvanick,https://www.businesswire.com/news/home/20230601005184/en/Galvanick-Announces-%2410-Million-in-Seed-Funding-for-Its-Industrial-Cybersecurity-Platform,Seed,Seed,2023-06-01,"MaC Venture Captial, Founders Fund, Village Global, Countdown Capital, Hanover Technology Investment Management, Shrug Capital, 8090 Industries, Silent Venture",Cybersecurity Solutions,Galvanick – Seed,Software & IT Services
100000000,Skydio,https://www.skydio.com/blog/skydio-raises-100-million,Late Stage Venture,Series C,2020-07-13,"Next47, DoCoMo, Levitate Capital, Andreessen Horowitz (a16z), IVP, Playground",Unmanned Aerial Vehicles (UAVs),Skydio – Series C,Platform Systems
7500000,Nominal,https://www.businesswire.com/news/home/20240418799842/en/Nominal-Emerges-From-Stealth-With-Backing-From-General-Catalyst-Lux-Capital-Founders-Fund-for-Navigating-Mission-Critical-Data-Analytics,Seed,Seed,2024-04-22,"Lux Capital, Founders Fund",Defense Software,Nominal – Seed,Software & IT Services
8000000,Antares,https://antaresindustries.com/updates/antares-announces-8m-seed-round,Seed,Seed,2023-10-31,"Caffeinated Capital, Humba Ventures, Pathbreaker Ventures, Rogue VC, Shrug Capital, Uncommon Captial",Power & Energy Systems,Antares – Seed,Support & Services
33600000,Dream Security,https://www.wsj.com/articles/ex-ceo-of-nso-group-raises-33-6-million-for-israeli-cyber-startup-ae8e7399,Early Stage Venture,Series A,2023-11-07,"Aleph, Group 11",Cybersecurity Solutions,Dream Security – Series A,Software & IT Services
230000000,Divergent Technologies,https://www.prnewswire.com/news-releases/divergent-technologies-inc-announces-closing-of-upsized-230-million-series-d-capital-raise-301985962.html,Late Stage Venture,Series D,2023-11-13,Hexagon AB,Manufacturing Support,Divergent Technologies – Series D,Support & Services
55000000,Saronic,https://www.prnewswire.com/news-releases/naval-maritime-autonomy-company-raises-55-million-in-series-a-fundraise-301951085.html,Early Stage Venture,Series A,2023-10-10,"Caffeinated Capital, 8VC, U.S. Innovative Technology Fund, Andreessen Horowitz (a16z), Lightspeed Venture Partners, Point72 Ventures, Silent Venture, Overmatch Ventures, Ensemble VC, Cubit Capital",Maritime Systems,Saronic – Series A,Platform Systems
0,Elroy Air,https://www.cooley.com/news/coverage/2024/2024-02-08-elroy-air-announces-nearly-50-million-in-new-funding,Miscellaneous,Undisclosed,2024-02-08,Shield Capital,Unmanned Aerial Vehicles (UAVs),Elroy Air – Undisclosed,Platform Systems
30000000,Allen Control Systems,https://www.businesswire.com/news/home/20250326066567/en/Allen-Control-Systems-Raises-%2430-Million-Series-A-to-Accelerate-Deployment-of-Autonomous-Weapon-Systems-and-Counter-Rapidly-Proliferating-Drone-Threat,Early Stage Venture,Series A,2025-03-27,"Craft Ventures, Inspired Capital, Rally Ventures",Small Arms & Light Weapons,Allen Control Systems – Series A,Weapon Systems
11200000,Reveal,https://techcrunch.com/2024/12/11/reveal-technology-raises-11m-to-scale-decision-dominance-tools-for-dod/,Early Stage Venture,Series A,2024-12-11,"Next Frontier Capital, Defy.VC, 8VC",Data Analytics & AI,Reveal – Series A,Software & IT Services
17500000,Portal Space Systems,https://www.portalsystems.space/portal-space-systems-raises-17-5m-in-oversubscribed-seed-round-to-build-multi-role-trans-orbital-spacecraft-powered-by-solar-thermal-propulsion,Seed,Seed,2025-04-01,"AlleyCorp, Mach33, FUSE, First In, TFX, Offline Ventures, Atypical",Military Satellites,Portal Space Systems – Seed,Space Systems
0,Dirac,,Seed,Undisclosed,2023-10-01,"Silent Venture, Acequia Capital, Eidetic Ventures",Manufacturing Support,Dirac – Undisclosed,Support & Services
29000000,Starfish Space,https://techcrunch.com/2024/11/13/starfish-space-raises-29m-to-launch-satellite-servicing-spacecraft/,Early Stage Venture,Strategic,2024-11-13,"Shield Capital, Point72 Ventures, Booz Allen Ventures, Aero X Ventures, Trousdale Ventures, TRAC VC, Munich Re Ventures, Toyota Ventures, NFX, Industrious Ventures",Military Satellites,Starfish Space – Strategic,Space Systems
