Fundraising Round,Sector,Investors,Type (Stage),Announcement ,Category,Date,Stage,Company,Amount
Portal Space Systems – Seed,Military Satellites,"AlleyCorp, Mach33, FUSE, First In, TFX, Offline Ventures, Atypical",Seed,https://www.portalsystems.space/portal-space-systems-raises-17-5m-in-oversubscribed-seed-round-to-build-multi-role-trans-orbital-spacecraft-powered-by-solar-thermal-propulsion,Space Systems,2025-04-01,Seed,Portal Space Systems,17500000
Dirac – Undisclosed,Manufacturing Support,"Silent Venture, Acequia Capital, Eidetic Ventures",Undisclosed,,Support & Services,2023-10-01,Seed,Dirac,0
Starfish Space – Strategic,Military Satellites,"Shield Capital, Point72 Ventures, Booz Allen Ventures, Aero X Ventures, Trousdale Ventures, TRAC VC, Munich Re Ventures, Toyota Ventures, NFX, Industrious Ventures",Strategic,https://techcrunch.com/2024/11/13/starfish-space-raises-29m-to-launch-satellite-servicing-spacecraft/,Space Systems,2024-11-13,Early Stage Venture,Starfish Space,29000000
HavocAI – Series A,Maritime Systems,,Series A,https://www.prnewswire.com/news-releases/havocai-adds-85m-in-new-capital-to-scale-proven-autonomy-capabilities-302580282.html,Platform Systems,2025-10-10,Early Stage Venture,HavocAI,85000000
Tiberius – Undisclosed,,"Never Lift Ventures, Blacklake, firedrop VC, Beaten Zone Ventures",Undisclosed,https://www.tectonicdefense.com/exclusive-tiberius-raises-4-5m-for-defense-as-a-service/,,2025-09-08,Miscellaneous,Tiberius,4500000
Divergent Technologies – Series A,Manufacturing Support,"Horizons Ventures, Altran Technologies",Series A,https://www.businesswire.com/news/home/20170125005154/en/Divergent-3D-Closes-23M-Series-A-Funding-Round-Led-by-Horizons-Ventures,Support & Services,2017-01-25,Early Stage Venture,Divergent Technologies,23000000
Saildrone – Undisclosed,Maritime Systems,"Export and Investment Fund of Denmark, Lux Capital, Washington Harbour Partners, Crowley Maritime Corporation, Academy Securities, Pinegrove",Undisclosed,https://www.saildrone.com/media-room/press-releases/saildrone-closes-60m-funding-maritime-autonomy-europe,Platform Systems,2025-05-13,Late Stage Venture,Saildrone,60000000
Castelion – Series A,Missiles & Guided Munitions,"Lightspeed Venture Partners, Lavrock Ventures, Cantos, First In, BlueYard Capital, Interlagos, Andreessen Horowitz (a16z)",Series A,https://www.businesswire.com/news/home/20250129937934/en/Castelion-Announces-100M-Financing,Weapon Systems,2025-01-29,Early Stage Venture,Castelion,70000000
Reality Defender – Extension,Cybersecurity Solutions,"Illuminate Financial, Booz Allen Ventures, IBM Ventures, Jefferies Family Office, Accenture, DCVC, Y Combinator, Partnership Fund for New York City",Extension,https://www.prnewswire.com/news-releases/reality-defender-expands-series-a-to-33-million-to-enhance-ai-detection-capabilities-302283098.html,Software & IT Services,2024-10-22,Early Stage Venture,Reality Defender,33000000
Forterra – Series C,Unmanned Ground Vehicles (UGVs),,Series C,https://www.forterra.com/posts/forterra-closes-238-million-series-c-cementing-leadership-in-autonomy-and-interoperable-systems,Platform Systems,2025-11-12,Late Stage Venture,Forterra,188000000
Destinus – Seed,Unmanned Aerial Vehicles (UAVs),"Conny & Co, Quiet Capital, One Way Ventures, Liquid2 Ventures, Cathexis Ventures, ACE & Company",Seed,https://www.destinus.com/post/destinus-closes-usd29m-seed-round,Platform Systems,2022-02-09,Seed,Destinus,29000000
Orasio – Seed,,"Frst, Global Founders Capital, Expeditions Fund",Seed,https://cdn.prod.website-files.com/681df0daf00c885331dd8d94/68236fb20c5895e7a414f8fa_Press%20release%20-%20Orasio%20completes%20first%20Seed%20round%20of%20financing.pdf,,2025-05-15,Seed,Orasio,17960516
HawkEye 360 – Series C,Space-based Sensors & ISR,"Razor’s Edge, Shield Capital, Dorilton Ventures, Advance, Esri, Adage Capital",Series C,https://www.he360.com/hawkeye-360-secures-55-million-series-c-funding-round/,Space Systems,2021-04-12,Late Stage Venture,HawkEye 360,55000000
Union – Seed,Manufacturing Support,"Bravo Victor Venture Capital, Regulus, Silent Venture, Decisive Point, Vanderbilt University, RKKVC, IronGate Capital",Seed,https://www.prnewswire.com/news-releases/union-the-wests-new-arsenal-of-national-security-lethalitythe-worlds-newest-manufacturing-superpower-302443156.html,Support & Services,2025-04-30,Seed,Union,50000000
Overland – Seed,Unmanned Ground Vehicles (UGVs),"Point72 Ventures, Shasta Ventures, Ascend, Pioneer Square Labs, Voyager Capital, Cubit Capital",Seed,https://www.overland.ai/news/overland-ai-secures-10m-in-seed-funding-to-accelerate-development-of-autonomous-vehicle-software-for-high-risk-missions,Platform Systems,2024-05-20,Seed,Overland,10000000
Shield AI – Series A,Data Analytics & AI,Andreessen Horowitz (a16z),Series A,https://web.archive.org/web/20170508031635/https://www.prnewswire.com/news-releases/shield-ai-raises-105-million-in-series-a-funding-led-by-andreesen-horowitz-300433742.html,Software & IT Services,2017-04-03,Early Stage Venture,Shield AI,10500000
K2 Space – Seed,Military Satellites,"First Round Capital, Republic Capital, Countdown Capital, Boost VC, Also Capital, Side Door Ventures, Earthrise Ventures, Spacecadet VC, Pathbreaker Ventures",Seed,https://www.cnbc.com/2023/03/10/k2-space-startup-building-massive-spacecraft.html,Space Systems,2023-03-10,Seed,K2 Space,8500000
Second Front Systems – Series B,Defense Software,"NEA, Moore Strategic Ventures, AE Industrial Partners",Series B,https://www.secondfront.com/resources/news/second-front-series-b/,Software & IT Services,2023-11-28,Early Stage Venture,Second Front Systems,40000000
Aeon – Undisclosed,Missiles & Guided Munitions,"Silent Venture, Quiet Capital, MaC Venture Captial, Valhalla Ventures",Undisclosed,https://www.linkedin.com/posts/michaelxbloch_how-small-smart-cheap-and-many-is-the-activity-7260414288605900802-4AEQ?utm_source=share&utm_medium=member_desktop&rcm=ACoAADxEwvABwn9C6xZ6wc5PM4dJKF5Uy1pj-SA,Weapon Systems,2024-11-07,Seed,Aeon,0
Firefly – Series C,Launch Services,"AE Industrial Partners, Mitsui & Co",Series C,https://fireflyspace.com/news/firefly-aerospace-closes-third-tranche-of-series-c-round-reaching-approximately-300-million-of-financing-to-date/,Space Systems,2023-11-10,Late Stage Venture,Firefly,300000000
REGENT – Series A,Maritime Systems,"8090 Industries, Founders Fund, Japan Airlines Innovation Fund, Lockheed Martin Ventures, Yamato Holdings, Point72 Ventures, Caffeinated Capital, Mark Cuban, UAE’s Strategic Development Fund, Future Planet Capital",Series A,https://www.regentcraft.com/news/regent-raises-60m-series-a-to-define-new-era-of-sustainable-transportation,Platform Systems,2023-10-05,Early Stage Venture,REGENT,60000000
TurbineOne – Series A,Data Analytics & AI,"Bessemer Venture Partners, The General Partnership, XYZ Ventures, Pallas Ventures",Series A,https://www.businesswire.com/news/home/20240327066760/en/TurbineOne-Raises-%2415M-in-Series-A-Funding-Round,Software & IT Services,2024-03-27,Early Stage Venture,TurbineOne,15000000
Saronic – Series B,Maritime Systems,"Andreessen Horowitz (a16z), Caffeinated Capital, 8VC, Elad Gil, NightDragon",Series B,https://www.prnewswire.com/news-releases/saronic-raises-175-million-in-series-b-funding-valuing-company-at-1-billion-302201280.html,Platform Systems,2024-07-19,Early Stage Venture,Saronic,175000000
Blue Water Autonomy – Series A,Maritime Systems,"Google Ventures, Eclipse, Riot Ventures, Impatient Ventures",Series A,https://www.prnewswire.com/news-releases/blue-water-autonomy-announces-50-million-series-a-led-by-gv-to-strengthen-us-maritime-power-with-autonomous-unmanned-ships-302538277.html,Platform Systems,2025-08-26,Early Stage Venture,Blue Water Autonomy,50000000
DEFCON AI – Seed,Defense Software,"Bessemer Venture Partners, Fifth Growth Fund, Red Cell Partners",Seed,https://www.businesswire.com/news/home/20240820394556/en/Defense-Tech-Startup-DEFCON-AI-Raises-%2444M-in-Seed-Financing,Software & IT Services,2024-08-20,Seed,DEFCON AI,44000000
Orbit Fab – Undisclosed,Military Satellites,"Lockheed Martin Ventures, Northrop Grumman Corporation, Asymmetry Ventures, SpaceFund, Marubeni Ventures, Audacious Venture Partners",Undisclosed,https://www.orbitfab.com/news/lm-ng-investment/,Space Systems,2021-09-07,Miscellaneous,Orbit Fab,10000000
K2 Space – Series A,Military Satellites,"Altimeter Capital, Alpine Space Ventures",Series A,https://www.cnbc.com/2024/02/13/startup-k2-space-raises-50-million.html,Space Systems,2024-02-13,Early Stage Venture,K2 Space,50000000
Hidden Level – Series B,Radar Systems,"Lauder Partners, Booz Allen Ventures, Washington Harbour Partners, Veteran Ventures, Valor Equity",Series B,https://www.hiddenlevel.com/thought-leadership/hidden-level-secures-100m-to-advance-national-security,Electronic Systems,2024-08-01,Early Stage Venture,Hidden Level,35000000
CX2 – Series A,Electronic Warfare Systems,"8VC, Andreessen Horowitz (a16z), Point72 Ventures, Pax Ventures",Series A,https://www.axios.com/2025/05/22/cx2-funding-mintz-electronic-warfare,Electronic Systems,2025-05-22,Early Stage Venture,CX2,31000000
Anduril Industries – Series A,,Founders Fund,Series A,https://www.wired.com/story/palmer-luckey-anduril-border-wall/,Software & IT Services,2018-05-01,Early Stage Venture,Anduril Industries,41000000
Edgerunner AI – Series A,Data Analytics & AI,"Madrona Ventures, Four Rivers Ventures, Alumni Ventures, HP Tech Ventures",Series A,https://www.edgerunnerai.com/news/edgerunner-raises-17-5m-to-develop-air-gapped-on-device-ai-for-the-warfighter,Software & IT Services,2025-05-01,Early Stage Venture,Edgerunner AI,12000000
Primer – Series B,Data Analytics & AI,"Lux Capital, Section 32, Mubadala Ventures, DCVC, Amplify, Avalon Capital Group, AME, Bloomberg Beta, Crosslink, In-Q-Tel",Series B,https://primer.ai/news/primer-adds-usd40m-to-expand-team-language-capabilities-and-enter-new/,Software & IT Services,2018-11-15,Early Stage Venture,Primer,40000000
Trypillian – Undisclosed,,Brooks Newmark,Undisclosed,https://inventure.com.ua/en/news/ukraine/defense-startup-trypillian-co-founded-by-ukrainians-raises-dollar5m-from-former-uk-minister-brooks-newmark,,2025-05-28,Miscellaneous,Trypillian,5000000
Armada – Series A,Data Analytics & AI,"Founders Fund, Shield Capital, Lux Capital, 8090 Industries, Felicis, Contrary, Valor Equity, Marlinspike, 137 Ventures, Koch Real Estate Investments, 8VC",Series A,https://www.businesswire.com/news/home/20231211233103/en/Armada-Raises-More-Than-55M-to-Bridge-the-Digital-Divide,Software & IT Services,2023-12-11,Early Stage Venture,Armada,55000000
Asylon – Series B,,"Insight Partners, Veteran Ventures, Allegion Ventures, GO PA Fund",Series B,https://asylonrobotics.com/asylon-robotics-24m-series-b-funding/,,2025-07-23,Early Stage Venture,Asylon,24000000
Paratus – Pre-Seed,Defense Software,"Bling Capital, Teamworthy Ventures, Work-Bench",Pre-Seed,https://www.linkedin.com/posts/luke-sommer-560b76174_hey-everyone-stuart-baker-roberto-medrano-activity-7354217511510241281-TFXf?utm_source=share&utm_medium=member_desktop&rcm=ACoAAAk_HOUBVRuNQld075fZp5ULmiAqfOZvVhM,Software & IT Services,2025-08-01,Seed,Paratus,2500000
Applied Intuition – Series E,Defense Software,"Bilal Zuberi, Elad Gil, Porsche Investments Management S.A., Andreessen Horowitz (a16z), General Catalyst, Mary Meeker, Human Capital, Henry Kravis, Ray Dalio, Mustafa Suleyman, John Quinn, Nico Rosberg",Series E,https://www.prnewswire.com/news-releases/applied-intuition-inc-grows-to-6-billion-valuation-securing-250-million-in-series-e-funding-to-advance-vehicle-software-and-ai-capabilities-302086239.html,Software & IT Services,2024-03-12,Late Stage Venture,Applied Intuition,250000000
Rocket Lab – Series B,Launch Services,"Bessemer Venture Partners, Khosla Ventures, K1W1 investment fund, Lockheed Martin Ventures",Series B,https://www.rocketlabusa.com/updates/rocket-lab-developer-of-the-electron-orbital-vehicle-closes-series-b-round-2/,Space Systems,2015-03-31,Early Stage Venture,Rocket Lab,0
Swarmer – Series A,,"Broadband Capital Investments, R-G.AI, D3 Ventures, Green Flag Ventures, Radius Capital, Network VC",Series A,https://www.vestbee.com/insights/articles/swarmer-raises-15-m,,2025-09-16,Early Stage Venture,Swarmer,15000000
Varda – Series B,Manufacturing Support,"Caffeinated Capital, Lux Capital, Founders Fund, Khosla Ventures",Series B,https://www.prnewswire.com/news-releases/varda-announces-90-million-series-b-funding-to-build-factories-in-space-302108949.html,Support & Services,2024-04-05,Early Stage Venture,Varda,90000000
Applied Intuition – Series D,Defense Software,"Elad Gil, Addition, Coatue, Semil Shah, Andreessen Horowitz (a16z), General Catalyst, Lux Capital",Series D,https://www.prnewswire.com/news-releases/applied-intuition-raises-175m-series-d-co-led-by-elad-gil-addition-and-coatue-management-at-3-6b-valuation-301422396.html,Software & IT Services,2021-11-11,Late Stage Venture,Applied Intuition,175000000
Firefly – Series D,Launch Services,"RPM Ventures, GiantLeap Capital, Human Element",Series D,https://fireflyspace.com/news/firefly-aerospace-closes-oversubscribed-175-million-series-d-capital-raise-with-new-lead-investor/,Space Systems,2024-11-12,Late Stage Venture,Firefly,175000000
Cambridge Aerospace – ,,,,https://www.tectonicdefense.com/cambridge-aerospace-emerges-from-the-shadows/,,,,Cambridge Aerospace,
Air Space Intelligence – Series B,Data Analytics & AI,"Bloomberg Beta, Renegade Partners, Spark Capital, Andreessen Horowitz (a16z)",Series B,https://www.globenewswire.com/news-release/2023/12/07/2792534/0/en/Air-Space-Intelligence-Secures-34M-Series-B-Financing-Led-by-a16z.html,Software & IT Services,2023-12-07,Early Stage Venture,Air Space Intelligence,34000000
SEMPRE – Undisclosed,Communication Equipment,"AE Ventures, 90 Degree North",Undisclosed,https://www.sempre.ai/news/ae-ventures-and-90-degree-north-holdings-o-lead-10-million-investment-in-sempre-to-advance-resilient-infrastructure-solutions,Electronic Systems,2024-09-16,Seed,SEMPRE,10000000
Blue Water Autonomy – Seed,Maritime Systems,"Eclipse, Riot Ventures, Impatient Ventures",Seed,https://www.prnewswire.com/news-releases/blue-water-autonomy-emerges-from-stealth-to-usher-in-new-era-of-autonomous-ships-and-modernize-the-maritime-economy-302426198.html,Platform Systems,2025-04-11,Seed,Blue Water Autonomy,14000000
HavocAI – Seed,Maritime Systems,"Scout Ventures, Trousdale Ventures, The Veteran Fund, Outlander VC, BVVC, Decisive Point, Alumni Ventures, New North Ventures",Seed,https://www.prnewswire.com/news-releases/havocai-closes-11m-seed-round-to-revolutionize-autonomous-uncrewed-surface-vessel-operations-302254210.html,Platform Systems,2024-09-20,Seed,HavocAI,11000000
Hidden Level – Series A,Radar Systems,"Lobby Capital, Lockheed Martin Ventures, Alsop Louie Partners, Pipeline Capital, Quest Venture Partners, Lauder Partners",Series A,https://www.hiddenlevel.com/thought-leadership/hidden-level-raises-17-6-million-in-series-a-funding,Electronic Systems,2021-06-23,Early Stage Venture,Hidden Level,17600000
Skydio – Series A,Unmanned Aerial Vehicles (UAVs),"Andreessen Horowitz (a16z), Accel",Series A,https://web.archive.org/web/20160331110451/http://www.skydio.com/blog/2016/01/series-a/,Platform Systems,2016-01-15,Early Stage Venture,Skydio,25000000
Morpheus Space – Series A,Military Satellites,"Alpine Space Ventures, Vsquared Ventures, Lavrock Ventures, Airbus, In-Q-Tel, Pallas Ventures, Techstars Ventures",Series A,https://www.prnewswire.com/news-releases/satellite-mobility-ecosystem-provider-morpheus-space-raises-28m-in-series-a-301624261.html,Space Systems,2022-09-14,Early Stage Venture,Morpheus Space,28000000
Anduril Industries – Series F,,"Founders Fund, Sands Capital, Fidelity Management & Research Company, Counterpoint Global, Baillie Gifford, Franklin Venture Partners, Altimeter",Series F,https://www.anduril.com/article/anduril-raises-usd1-5-billion-to-rebuild-the-arsenal-of-democracy/,Software & IT Services,2024-08-07,Late Stage Venture,Anduril Industries,1500000000
Nominal – Series B,Defense Software,"Sequoia Capital, Lightspeed Venture Partners, General Catalyst, Lux Capital, Founders Fund",Series B,https://blog.nominal.io/series-b,Software & IT Services,2025-06-12,Early Stage Venture,Nominal,75000000
Impulse Space – Seed,Launch Services,Founders Fund,Seed,https://www.impulsespace.com/updates/impulse-space-propulsion-secures-20m-in-seed-round-led-by-founders-fund,Space Systems,2022-03-29,Seed,Impulse Space,20000000
Fortem Technologies – Series A,Electronic Warfare Systems,"DCVC, Boeing, Mubadala Ventures, Manifest Growth, New Ground Ventures, Signia Venture Partners",Series A,https://fortemtech.com/press-releases/2018-03-15-fortem-raises-15m-series-a/,Electronic Systems,2018-03-15,Early Stage Venture,Fortem Technologies,15000000
Elroy Air – Undisclosed,Unmanned Aerial Vehicles (UAVs),Marlinspike Capital,Undisclosed,https://elroyair.com/company/news/press-releases/new-ceo-and-financing-announcement/,Platform Systems,2025-01-14,Miscellaneous,Elroy Air,0
Radian Aerospace – Seed,Launch Services,"Fine Structure Ventures, EXOR, The Venture Collective, Helios Capital, SpaceFund, The Private Shares Fund, Gaingels, Explorer 1, Type 1 Ventures",Seed,https://www.prnewswire.com/news-releases/radian-aerospace-emerges-from-stealth-announces-seed-funding-led-by-fine-structure-ventures-301463373.html,Space Systems,2022-01-19,Seed,Radian Aerospace,27500000
Skydio – Extension,Unmanned Aerial Vehicles (UAVs),"KDDI, Axon, Linse Capital",Extension,https://techcrunch.com/2024/11/15/drone-manufacturer-skydio-raises-170-million-extension-round/,Platform Systems,2024-11-15,Late Stage Venture,Skydio,170000000
Scout AI – Seed,,"Align Ventures, Booz Allen Ventures, Draper Associates, Decisive Point, Perot Jain, Sigmas Group, Evolution VC, BVVC, Habitat Partners, Piedmont Capital Investments, FJ Labs, Revelry Venture Partners, Monte Carlo Capital, Expansion VC, Gaingels",Seed,https://www.prnewswire.com/news-releases/scout-ai-emerges-from-stealth-with-15m-seed-round-lands-2-dod-contracts-and-unveils-fury--robotic-foundation-model-for-defense-302429902.html,,2025-04-16,Seed,Scout AI,15000000
Onebrief – Series C,Defense Software,"General Catalyst, Insight Partners, Caffeinated Capital, 9Yards Capital, Human Capital",Series C,https://www.onebrief.com/content-hub/series-c-announcement,Software & IT Services,2025-02-10,Late Stage Venture,Onebrief,50000000
Neros – Seed,Unmanned Aerial Vehicles (UAVs),"Sequoia Capital, Cantos, Peter Thiel, D3, A*, Box Group, Long Journey",Seed,https://medium.com/@sorenma/neros-closes-10-9m-opens-new-factory-13f75df7f059,Platform Systems,2024-05-20,Seed,Neros,10900000
Helsing – Series D,Data Analytics & AI,"Prima Materia, Saab, Lightspeed Venture Partners, Accel, Plural, General Catalyst",Series D,https://helsing.ai/newsroom/helsing-raises-eur600m-to-invest-in-european-technological-sovereignty,Software & IT Services,2025-06-17,Late Stage Venture,Helsing,693000000
Freeform – Undisclosed,Manufacturing Support,"NVIDIA, AE Ventures",Undisclosed,https://www.prnewswire.com/news-releases/freeform-secures-investments-from-nvidias-nventures-and-ae-ventures-to-bring-ai-to-metal-3d-printing-302283122.html,Support & Services,2024-10-22,Seed,Freeform,14000000
Darkhive – Seed,Unmanned Aerial Vehicles (UAVs),"Crosslink, Stellar Ventures, MVP Ventures, Capital Factory",Seed,https://www.prnewswire.com/news-releases/darkhive-inc-closes-4m-seed-round-to-scale-development-of-low-cost-autonomous-drones-for-defense-and-public-safety-302002536.html,Platform Systems,2023-11-30,Seed,Darkhive,4000000
Esper Satellite Imagery – Pre-Seed,Space-based Sensors & ISR,"Stellar Ventures, Day One Ventures, Dolby Family Ventures",Pre-Seed,https://techcrunch.com/2024/03/04/espers-first-hyperspectral-demonstrator-satellite-lifts-off-on-spacex-rocket/,Space Systems,2024-03-04,Seed,Esper Satellite Imagery,1000000
Vulcan Elements – Series A,Advanced Materials,Altimeter,Series A,https://www.tectonicdefense.com/rare-earth-magnet-maker-vulcan-elements-raises-65m/,Support & Services,2025-08-12,Early Stage Venture,Vulcan Elements,65000000
Stoke – Series D,,,Series D,https://www.stokespace.com/stoke-space-technologies-raises-510-million-to-scale-manufacturing-of-fully-reusable-nova-launch-vehicle/,,2025-10-08,Late Stage Venture,Stoke,510000000
Fortem Technologies – Seed,Electronic Warfare Systems,"Signia Venture Partners, DCVC",Seed,https://techcrunch.com/2017/05/06/fortem-raises-5-5-million-to-hunt-and-take-down-unwanted-drones/,Electronic Systems,2017-05-06,Seed,Fortem Technologies,5500000
HawkEye 360 – Series D,Space-based Sensors & ISR,"Insight Partners, Seraphim Space Investment Trust, Strategic Development Fund, Jacobs, New Vista Capital, Gula Tech Adventures, 116 Street Ventures, New North Ventures, Advance, Razor’s Edge, NightDragon, SVB Capital, Shield Capital, Adage Capital",Series D,https://www.he360.com/hawkeye-360-raises-145-million-in-series-d-round-to-expand-dominance-of-the-commercial-radio-frequency-geoint-market/,Space Systems,2021-11-08,Late Stage Venture,HawkEye 360,145000000
Impulse Space – Series A,Launch Services,"RTX Ventures, Founders Fund, Lux Capital, Airbus, Space Capital",Series A,https://www.impulsespace.com/updates/impulse-space-secures-dollar45m-in-series-a-funding-round,Space Systems,2023-07-24,Early Stage Venture,Impulse Space,45000000
Aurelius  – Undisclosed,Directed Energy Weapons,"Outlander VC, Decisive Point, 640 Oxford, Detroit Venture Partners, First In, Founders Inc",Undisclosed,https://www.linkedin.com/posts/aurelius-systems_aurelius-systems-secures-funding-to-combat-activity-7218993625240588290-6mUL/?utm_source=share&utm_medium=member_desktop&rcm=ACoAADOjasQBkWG1wHhbP4y-8rTo-nx_MjPeous,Weapon Systems,2024-07-01,Miscellaneous,Aurelius ,0
Spear AI – Seed,,"Cortical Ventures, Scare the Bear",Seed,https://www.reuters.com/business/spear-ai-raises-first-round-funding-apply-ai-submarine-data-2025-07-25/,,2025-07-25,Seed,Spear AI,2300000
Divergent Technologies – Undisclosed,Manufacturing Support,Rochefort,Undisclosed,https://www.prnewswire.com/news-releases/divergent-technologies-secures-290m-in-capital-led-by-rochefort-asset-management-to-accelerate-us-defense-manufacturing-revolution-302555798.html?tc=eml_cleartime,Support & Services,2025-09-15,Miscellaneous,Divergent Technologies,290000000
Pilgrim – Seed,Health & Biotech,"Thiel Capital, Cantos, Refactor",Seed,https://www.businessinsider.com/pilgrim-jake-adler-4-million-funding-biotech-product-bold-video-2025-8,Support & Services,2025-03-17,Seed,Pilgrim,4300000
X-Bow – Series B,Missiles & Guided Munitions,"Lockheed Martin Ventures, Razor’s Edge, Crosslink, Balerion Space Ventures, Boeing Ventures, Bravo Victor Venture Capital, Upsher Management Company, Capital Factory, Arkenstone Capital, Event Horizon Capital",Series B,https://www.prnewswire.com/news-releases/x-bow-systems-announces-final-closing-of-over-105-million-series-b-funding-to-deliver-state-of-the-art-defense-technologies-at-speed-and-scale-302452380.html,Weapon Systems,2025-05-12,Early Stage Venture,X-Bow,105000000
Distributed Spectrum – Series A,Electronic Warfare Systems,"Conviction, Shield Capital, Nat Friedman, Felicis, XFund",Series A,https://www.distributedspectrum.com/series-a-announcement,Electronic Systems,2025-03-18,Early Stage Venture,Distributed Spectrum,25000000
Mach Industries – Series A,Unmanned Aerial Vehicles (UAVs),"Bedrock, Marque Ventures, DCVC",Series A,https://techcrunch.com/2023/10/04/defense-startup-mach-industries-closes-79m-series-a-at-335m-valuation/,Platform Systems,2023-10-04,Early Stage Venture,Mach Industries,79000000
Applied Intuition – Series F,Defense Software,"BlackRock, Kleiner Perkins, Lux Capital, Fidelity Management & Research Company",Series F,https://www.appliedintuition.com/news/series-f,Software & IT Services,2025-06-17,Late Stage Venture,Applied Intuition,600000000
TurbineOne – Series B,Data Analytics & AI,"The General Partnership, Bessemer Venture Partners, XYZ Ventures, StepStone Group, Proof VC",Series B,https://businesswire.com/news/home/20250514400385/en/TurbineOne-Raises-%2436M-Series-B-to-Deploy-AI-at-the-Tactical-Edge,Software & IT Services,2025-05-14,Early Stage Venture,TurbineOne,36000000
Kilsar – Seed,,"Lightbank, Cotulla Capital, Techstars Ventures, Scalewolf",Seed,https://www.prnewswire.com/news-releases/kilsar-raises-3-7m-to-revolutionize-maintenance--maintenance-training-with-ai-302507323.html,Support & Services,2025-07-16,Seed,Kilsar,3700000
ZeroMark – Seed,Small Arms & Light Weapons,"Ground Up Ventures, Andreessen Horowitz (a16z)",Seed,https://www.businesswire.com/news/home/20240529043192/en/ZeroMark-Secures-7M-in-Seed-Funding-for-%e2%80%9cHandheld-Iron-Dome%e2%80%9d,Weapon Systems,2024-05-29,Seed,ZeroMark,7000000
TEKEVER – Undisclosed,Unmanned Aerial Vehicles (UAVs),"Baillie Gifford, NATO Innovations Fund, National Security Strategic Investment Fund (NSSIF), Crescent Cove Advisors, Iberis Semper, Cedrus Capital",Undisclosed,https://www.tekever.com/news/tekever-raises-70-millions-euros-and-brings-strategic-investors-on-board/,Platform Systems,2024-11-22,Miscellaneous,TEKEVER,74500000
Anduril Industries – Series E,,"Valor Equity, Founders Fund, General Catalyst, 8VC, Lux Capital, Thrive Capital, DFJ Growth, Elad Gil, Lachy Groom, Human Capital, Marlinspike, WCM Investment Management, MVP Ventures, U.S. Innovative Technology Fund, Lightspeed Venture Partners",Series E,https://www.anduril.com/article/anduril-raises-usd1-48-billion-in-series-e-funding/,Software & IT Services,2022-12-02,Late Stage Venture,Anduril Industries,1480000000
