Company,Investors,Amount,Stage,Category,Sector,Date,Type (Stage),Announcement ,Fundraising Round
Electra,"Prysm Capital, Lockheed Martin Ventures, Honeywell, Safran, Statkraft Ventures, Virginia Innovation Partnership Corporation",115000000,Early Stage Venture,Platform Systems,Military Aircraft,2025-04-21,Series B,https://www.electra.aero/news/electra-raises-115-million,Electra – Series B
X-Bow,"Razor’s Edge, Boeing Ventures, Lockheed Martin Ventures, Crosslink, Balerion Space Ventures",70000000,Early Stage Venture,Weapon Systems,Missiles & Guided Munitions,2024-07-10,Series B,https://www.prnewswire.com/news-releases/x-bow-raises-more-than-70-million-series-b-to-accelerate-expansion-of-hypersonic-and-solid-rocket-motor-technologies-302193599.html,X-Bow – Series B
True Anomaly,"Eclipse, Riot Ventures, Champion Hill Ventures, Space VC, Narya",17000000,Early Stage Venture,Space Systems,Military Satellites,2023-04-06,Series A,https://www.prnewswire.com/news-releases/true-anomaly-emerges-from-stealth-to-revolutionize-space-security-stability-and-sustainability-301791297.html,True Anomaly – Series A
Chaos,"New Enterprise Associates, Accel, StepStone Group, Overmatch Ventures, Tru Arrow, Valor Equity",275000000,Late Stage Venture,Electronic Systems,Radar Systems,2025-05-02,Series C,https://www.businesswire.com/news/home/20250502192148/en/CHAOS-Industries-Raises-%24275-Million-Series-C-to-Advance-Defense-and-National-Security-Technology-Innovation,Chaos – Series C
Merlin Labs,"Google Ventures, First Round Capital",25000000,Early Stage Venture,Platform Systems,Military Aircraft,2021-05-26,Series A,https://www.prnewswire.com/news-releases/merlin-labs-announces-25m-funding-round-and-partnership-to-bring-autonomy-to-55-aircraft-fleet-301300079.html,Merlin Labs – Series A
Onebrief,"Human Capital, 9Yards Capital, Caffeinated Capital",53000000,Early Stage Venture,Software & IT Services,Defense Software,2024-12-11,Series B,https://www.onebrief.com/content-hub/onebrief-secures-53m-to-build-the-future-of-military-staffs,Onebrief – Series B
Adyton,"Venrock, Khosla Ventures, Liquid 2 Ventures, Alumni Ventures, Initialized Capital, Kindred Ventures, Leblon Capital",11000000,Early Stage Venture,Software & IT Services,Defense Software,2025-05-15,Undisclosed,https://www.tectonicdefense.com/exclusive-adyton-raises-11m-scores-a-7m-navy-contract/,Adyton – Undisclosed
Elroy Air,"Lockheed Martin Ventures, Marlinspike Capital, Prosperity7 Ventures, Catapult Ventures, DiamondStream Partners, Side X Side Management, Precursor Ventures, Shield Capital",40000000,Early Stage Venture,Platform Systems,Unmanned Aerial Vehicles (UAVs),2021-08-03,Series A,https://elroyair.com/company/news/press-releases/elroy-series-a-financing/,Elroy Air – Series A
Reality Defender,"DCVC, Comcast, Partnership Fund for New York City, Rackhouse Venture Capital, AI Grant, Y Combinator",15000000,Early Stage Venture,Software & IT Services,Cybersecurity Solutions,2023-10-17,Series A,https://www.prnewswire.com/news-releases/deepfake-detection-platform-reality-defender-secures-15-million-in-series-a-funding-led-by-dcvc-301958923.html,Reality Defender – Series A
Firefly,AE Industrial Partners,75000000,Early Stage Venture,Space Systems,Launch Services,2022-04-19,Series B,https://fireflyspace.com/news/ae-industrial-partners-leads-75-million-series-b-growth-equity-investment-in-firefly-aerospace-a-leading-provider-of-launch-and-in-space-vehicles/,Firefly – Series B
Astro Mechanica,"Andreessen Horowitz (a16z), Lowercarbon, Giant Step Capital, Alumni Ventures, Voyager Capital, Dolby Family Ventures, Eli Dourado, Julian Capital, Industrious Ventures, Myelin VC, Not Boring, Wayfinder, Y Combinator, Astera Institute",27100000,Miscellaneous,Platform Systems,Military Aircraft,2025-04-17,Undisclosed,https://www.tectonicdefense.com/exclusive-astro-mechanica-raises-27-1m-for-supersonic-flight/,Astro Mechanica – Undisclosed
Bounce Imaging,"R42 Group, Good Growth Capital, Tanis Ventures, Helen Greiner, Ed Roberts, Backstage Capital",4200000,Early Stage Venture,Electronic Systems,Radar Systems,2022-05-02,Series A,https://bounceimaging.com/2022-5-2-bounce-imaging-raises-4-2-million-series-a-prime-round-adds-former-pentagon-chief-to-board/,Bounce Imaging – Series A
Beacon AI,"Costanoa Ventures, Scout Ventures, Sam Altman, JetBlue Ventures",15000000,Early Stage Venture,Software & IT Services,Defense Software,2024-10-15,Series A,https://www.prnewswire.com/news-releases/beacon-ai-secures-15m-in-series-a-funding-to-bring-ai-into-flight-decks-302275720.html,Beacon AI – Series A
Anduril Industries,"General Catalyst, Founders Fund, 8VC",17500000,Seed,Software & IT Services,,2017-06-01,Seed,https://web.archive.org/web/20210414015255/https://www.wired.com/story/palmer-luckey-anduril-border-wall/,Anduril Industries – Seed
Ursa Major,"XN, Alsop Louie Partners, Explorer 1, Dolby Family Ventures, Alpha Edison, Space Capital, Harpoon Ventures",85000000,Late Stage Venture,Weapon Systems,Missiles & Guided Munitions,2021-12-07,Series C,https://www.ursamajor.com/media/press-release/ursa-major-raises-usd85-million-in-series-c-funding,Ursa Major – Series C
Dedrone,"Axon, Aqton Partners, Menlo Ventures, Target Partners, TempoCap, John Chambers, Felicis",30500000,Late Stage Venture,Electronic Systems,Electronic Warfare Systems,2021-12-17,Series C,https://www.dedrone.com/press/dedrone-secures-30-5-million-series-c-to-protect-airspace-against-unauthorized-drones,Dedrone – Series C
Forterra,"Moore Strategic Ventures, XYZ Ventures, Hedosophia, Standard Investments, Enlightenment Capital, Crescent Cove Advisors, Four More Capital",75000000,Early Stage Venture,Platform Systems,Unmanned Ground Vehicles (UGVs),2024-09-10,Series B,https://www.forterra.com/posts/forterra-raises-75-million-series-b,Forterra – Series B
Applied Intuition,"Lux Capital, Andreessen Horowitz (a16z), General Catalyst, Bilal Zuberi",125000000,Late Stage Venture,Software & IT Services,Defense Software,2020-10-27,Series C,https://www.prnewswire.com/news-releases/applied-intuition-raises-125m-series-c-from-existing-investors-lux-capital-andreessen-horowitz-and-general-catalyst-301159996.html,Applied Intuition – Series C
Ethos,"The Westly Group, Norwest Venture Partners, Pear VC",30000000,Early Stage Venture,,,2024-06-12,Series A,https://www.prnewswire.com/news-releases/enterprise-saas-training-platform-learn-to-win-closes-30-million-series-a-funding-round-302169853.html,Ethos – Series A
Divergent Technologies,"Shanghai Alliance , Altran Technologies",65000000,Early Stage Venture,Support & Services,Manufacturing Support,2017-11-21,Series B,https://www.businesswire.com/news/home/20171121006158/en/Divergent-3D-Announces-Series-B-and-Related-Funding,Divergent Technologies – Series B
Firehawk Aerospace,"1789 Capital, Draper Associates, BOKA Group",60000000,Late Stage Venture,Weapon Systems,Missiles & Guided Munitions,2025-01-06,Series C,https://www.forbes.com/sites/davidjeans/2025/01/06/trump-jr-1789-capital-firehawk/,Firehawk Aerospace – Series C
Interlune,"Seven Seven Six, Aurelia Foundry, Gaingels, Liquid2 Ventures, Shasta Ventures",18000000,Seed,Support & Services,Logistics & Supply Chain,2024-03-13,Seed,https://www.interlune.space/press-release/space-resources-startup-interlune-raises-18-million-in-seed-capital,Interlune – Seed
Swarmbotics AI,"Quiet Capital, Silent Venture, LMNT Ventures, Soma Capital",4000000,Seed,Platform Systems,Unmanned Ground Vehicles (UGVs),2024-08-19,Undisclosed,https://techcrunch.com/2024/08/19/swarmbiotics-founders-grew-obsessed-with-robot-swarms-and-now-plan-to-bring-them-to-the-battlefield/,Swarmbotics AI – Undisclosed
World View,SNC,0,Late Stage Venture,Space Systems,Space-based Sensors & ISR,2024-02-27,Series D,https://www.businesswire.com/news/home/20240227589814/en/World-View-Secures-Strategic-Series-D-Funding-Led-by-SNC,World View – Series D
Apex Space,"Andreessen Horowitz (a16z), Shield Capital",16000000,Early Stage Venture,Space Systems,Military Satellites,2023-06-22,Series A,https://www.businesswire.com/news/home/20230622417907/en/Apex-Raises-16M-in-Series-A-Funding-and-Reveals-Customers-Flying-on-its-First-Aries-Satellite-Bus,Apex Space – Series A
True Anomaly,"Accel, Meritech Capital, Eclipse, Riot Ventures, Menlo Ventures, 645 Ventures, ACME Capital, Space VC, Champion Hill Ventures, Narya",260000000,Late Stage Venture,Space Systems,Military Satellites,2025-04-30,Series C,https://www.trueanomaly.space/newsroom/announcing-our-260m-fundraise,True Anomaly – Series C
Hermeus,"Sam Altman, Founders Fund, In-Q-Tel, Khosla Ventures, Canaan Partners, Bling Capital, Revolution's Rise of the Rest Seed Fund",100000000,Early Stage Venture,Platform Systems,Military Aircraft,2022-03-10,Series B,https://www.hermeus.com/press-release-series-b,Hermeus – Series B
Solestial,"Airbus, AEI HorizonX, GPVC, Stellar Ventures, Industrious Ventures",10000000,Seed,Support & Services,Power & Energy Systems,2022-10-11,Seed,https://www.businesswire.com/news/home/20221011005573/en/Airbus-Ventures-Leads-Solestial%E2%80%99s-Oversubscribed-10M-Seed-Round,Solestial – Seed
Dive Technologies,"Tanis Venture Management, Virginia Tech Carilion Innovation Fund, Mill Town Capital, Virginia Tech Carilion Seed Fund, Cavalier Angels, Charlottesville Angel Network",4000000,Miscellaneous,Platform Systems,Maritime Systems,2020-12-21,Undisclosed,https://www.businesswire.com/news/home/20201221005171/en/Dive-Technologies-Closes-on-New-Equity-Financing-Round-to-Deliver-on-2021-Commercial-and-Defense-Opportunities,Dive Technologies – Undisclosed
Overland,"8VC, Point72 Ventures, Overmatch Ventures, Shasta Ventures, Ascend, Osage University Partners, Caprock",32000000,Early Stage Venture,Platform Systems,Unmanned Ground Vehicles (UGVs),2025-01-22,Series A,https://www.overland.ai/news/overland-ai-raises-32m-in-series-a-to-transform-ground-operations-for-defense,Overland – Series A
X-Bow,"Crosslink, Razor’s Edge, Lockheed Martin Ventures, Balerion Space Ventures, Bravo Victor Venture Capital, Capital Factory",0,Miscellaneous,Weapon Systems,Missiles & Guided Munitions,2023-11-16,Strategic,https://www.prnewswire.com/news-releases/x-bow-systems-closes-funding-from-lockheed-martin-ventures-and-company-insiders-301991355.html,X-Bow – Strategic
Chaos,"Accel, 8VC, Overmatch Ventures, Lerner Enterprises",145000000,Early Stage Venture,Electronic Systems,Radar Systems,2024-11-13,Series B,https://www.businesswire.com/news/home/20241112876622/en/CHAOS-Industries-Raises-145-Million-Series-B-to-Accelerate-Defense-and-National-Security-Technology-Development,Chaos – Series B
AnySignal,"BlueYard Capital, First In, Also Capital, Acequia Capital, Caffeinated Capital",5000000,Seed,Electronic Systems,Radar Systems,2023-10-16,Seed,https://anysignal.medium.com/anysignal-closes-seed-round-to-build-multi-domain-radio-platform-ab8aa6844bc8,AnySignal – Seed
HawkEye 360,"Manhattan Venture Partners, Insight Partners, NightDragon, Alumni Ventures, Strategic Development Fund, Razor’s Edge, Adage Capital",58000000,Late Stage Venture,Space Systems,Space-based Sensors & ISR,2023-07-13,Extension,https://www.he360.com/hawkeye-360-receives-58-million-in-series-d-1-funding-to-introduce-a-new-satellite-architecture-and-accelerate-data-science-efforts/,HawkEye 360 – Extension
Theseus,"First Round Capital, Y Combinator, Lux Capital",4300000,Seed,Electronic Systems,Navigation & Guidance Systems,2025-04-17,Seed,https://www.theseus.us/blog/theseus-seed,Theseus – Seed
AMCA,"Founders Fund, Andreessen Horowitz (a16z), Lux Capital, Caffeinated Capital",76000000,Seed,Support & Services,Manufacturing Support,2025-04-08,Seed,https://amca.co/launch/,AMCA – Seed
Helsing,Prima Materia,118000000,Early Stage Venture,Software & IT Services,Data Analytics & AI,2021-11-09,Series A,https://www.ft.com/content/fc69f2b8-8016-4833-a9e1-61154e4b25eb,Helsing – Series A
